text_videotitle,video_id,published_at,channel_id,video_viewcount,title_clean,title_wordcount,is_date_like
Master Your Driving Routine for More Rides Daily! #shorts,64spQvDeCws,2025-12-23T02:00:02Z,UCGT7T2ngAjrsTk3PI8o85tA,724,master your driving routine for more rides daily shorts,9,False
Music Festival Driving (Maximize Earnings FAST) #shorts,S8P6jlsF_YA,2025-12-22T13:59:27Z,UCGT7T2ngAjrsTk3PI8o85tA,916,music festival driving maximize earnings fast shorts,7,False
Your Secret Event Calendar Hack! (Unlock Events) #shorts,XaQGFdpgR_o,2025-12-22T02:04:48Z,UCGT7T2ngAjrsTk3PI8o85tA,814,your secret event calendar hack unlock events shorts,8,False
HOW to FIND the BEST 🆚 WORST UBER LOCATIONS !!! #shorts,HeN8EfRviz8,2025-12-21T13:58:40Z,UCGT7T2ngAjrsTk3PI8o85tA,931,how to find the best worst uber locations shorts,9,False
Holiday Rideshare Strategy and Maximize Earnings! #shorts,YsdwDLw14HU,2025-12-21T01:57:02Z,UCGT7T2ngAjrsTk3PI8o85tA,1288,holiday rideshare strategy and maximize earnings shorts,7,False
"Uber Driving Strategy (Beat Traffic, Make More Money) #shorts",XZ5B2wtgOqA,2025-12-20T14:00:49Z,UCGT7T2ngAjrsTk3PI8o85tA,1403,uber driving strategy beat traffic make more money shorts,9,False
Uber/Lyft Concert Driving (How to Maximize Earnings at Festivals) #shorts,FRWgE2XH_Wc,2025-12-20T02:01:26Z,UCGT7T2ngAjrsTk3PI8o85tA,836,uber lyft concert driving how to maximize earnings at festivals shorts,11,False
Better UBER Rides (Have the AI Analyzes Your Driver Data) #shorts,zBDoo907yw8,2025-12-19T13:55:46Z,UCGT7T2ngAjrsTk3PI8o85tA,1013,better uber rides have the ai analyzes your driver data shorts,11,False
Worst New Year's UBER Ride (Drunk Passenger's Story) #shorts,8xfV6VlTDTc,2025-12-19T01:59:50Z,UCGT7T2ngAjrsTk3PI8o85tA,1472,worst new year s uber ride drunk passenger s story shorts,11,False
How to EARN $30/Hour Driving UBER (Hidden Locations  EXPOSED) #shorts,m46VXFPYPwE,2025-12-18T14:02:55Z,UCGT7T2ngAjrsTk3PI8o85tA,1235,how to earn 30 hour driving uber hidden locations exposed shorts,11,False
Uber’s Locations EXPOSED (That Drivers Don’t Want You to Know) 🚗💨 EP.20 [ Part 4 ],zbePJu5RPYQ,2025-12-17T14:00:06Z,UCGT7T2ngAjrsTk3PI8o85tA,1663,uber s locations exposed that drivers don t want you to know ep 20 part 4,16,False
The Alpha State Secret (Unlock Your Subconscious) #shorts,f7q_fGKeB6A,2025-12-17T13:57:45Z,UCGT7T2ngAjrsTk3PI8o85tA,744,the alpha state secret unlock your subconscious shorts,8,False
Unlock Your Brainwaves: Control Your Mind with Theta #shorts,orQIqtvXB4s,2025-12-16T13:59:06Z,UCGT7T2ngAjrsTk3PI8o85tA,619,unlock your brainwaves control your mind with theta shorts,9,False
Why You SHOULDN'T Drive in Cities that have Waymo & RoboTaxis #shorts,G-KxN157_4Y,2025-12-15T13:55:21Z,UCGT7T2ngAjrsTk3PI8o85tA,1080,why you shouldn t drive in cities that have waymo robotaxis shorts,12,False
Transit Hub & Mystery Spot Locations for Uber Drivers #shorts,LBUr69JXkKg,2025-12-14T13:55:18Z,UCGT7T2ngAjrsTk3PI8o85tA,778,transit hub mystery spot locations for uber drivers shorts,9,False
The Secret to Better Uber Locations #shorts,V3t0TPgxSp0,2025-12-13T14:20:11Z,UCGT7T2ngAjrsTk3PI8o85tA,1044,the secret to better uber locations shorts,7,False
How to Maximize Your Earnings as an Uber Driver #shorts,Qid9_3Nax1E,2025-12-12T13:45:01Z,UCGT7T2ngAjrsTk3PI8o85tA,999,how to maximize your earnings as an uber driver shorts,10,False
Near a Freeway = Better Waiting Location for Uber Drivers #shorts,-QWDl_j7ZE0,2025-12-11T13:50:02Z,UCGT7T2ngAjrsTk3PI8o85tA,854,near a freeway better waiting location for uber drivers shorts,10,False
Get GOOD Uber Rides from Hospitals and ??? #shorts,mGp7xwuU3Y8,2025-12-10T13:44:37Z,UCGT7T2ngAjrsTk3PI8o85tA,941,get good uber rides from hospitals and shorts,8,False
MORE LOCATIONS for GIG WORKERS (Max Rides) #shorts,Zo-kK1Jxk1k,2025-12-09T13:45:36Z,UCGT7T2ngAjrsTk3PI8o85tA,625,more locations for gig workers max rides shorts,8,False
"Costco, Walmart, IKEA (Great Ride Locations for rideshare) #shorts",jMG7XHefRsQ,2025-12-08T13:58:12Z,UCGT7T2ngAjrsTk3PI8o85tA,758,costco walmart ikea great ride locations for rideshare shorts,9,False
Uber Eats: Best College Town Delivery Strategy Revealed #shorts,8OP5KOgxCvk,2025-12-07T13:59:52Z,UCGT7T2ngAjrsTk3PI8o85tA,1016,uber eats best college town delivery strategy revealed shorts,9,False
The County Line Trick REVEALED & FUBER #shorts,mYnHTBfG1ac,2025-12-06T13:56:11Z,UCGT7T2ngAjrsTk3PI8o85tA,922,the county line trick revealed fuber shorts,7,False
How to Unlock Profitable Rideshare Locations #shorts,Kr0BX38RmYs,2025-12-05T13:58:18Z,UCGT7T2ngAjrsTk3PI8o85tA,797,how to unlock profitable rideshare locations shorts,7,False
50% Discount Code for Start Your Own Rideshare Business Course #shorts,PlZcYcz9z6M,2025-12-04T13:56:39Z,UCGT7T2ngAjrsTk3PI8o85tA,810,50 discount code for start your own rideshare business course shorts,11,False
Downtowns & Parking Meter = Awesome Rideshare Locations #shorts,s2EFzuAqsZQ,2025-12-03T13:56:57Z,UCGT7T2ngAjrsTk3PI8o85tA,843,downtowns parking meter awesome rideshare locations shorts,7,False
Uber Eats & Downtowns = Secret Locations + Earning #shorts,WTh5xNbcXQ8,2025-12-02T13:58:13Z,UCGT7T2ngAjrsTk3PI8o85tA,740,uber eats downtowns secret locations earning shorts,7,False
Wait by LUXURY HOTELS and Find Wealthy Rideshare Opportunities  #shorts,6M3Wo1XFqV0,2025-12-01T13:55:13Z,UCGT7T2ngAjrsTk3PI8o85tA,1080,wait by luxury hotels and find wealthy rideshare opportunities shorts,10,False
Maximize Rideshare Profits With Amusement Park Rides #shorts,tCubQPTD_KQ,2025-11-30T14:04:52Z,UCGT7T2ngAjrsTk3PI8o85tA,1180,maximize rideshare profits with amusement park rides shorts,8,False
Convention Center Rides (How to Make Money with Uber) #shorts,YINYhvoZsIE,2025-11-29T14:03:00Z,UCGT7T2ngAjrsTk3PI8o85tA,813,convention center rides how to make money with uber shorts,10,False
Uber Airport Strategy (High-Paying Rides & More) #shorts,AV60Kybrx9w,2025-11-28T19:05:32Z,UCGT7T2ngAjrsTk3PI8o85tA,2018,uber airport strategy high paying rides more shorts,8,False
Uber & Lyft Secret Locations for Cherry-Picking Passengers! #shorts,SJg7yS6neNw,2025-11-27T13:59:27Z,UCGT7T2ngAjrsTk3PI8o85tA,1457,uber lyft secret locations for cherry picking passengers shorts,9,False
Uber Hotspots (Secret Locations for Profitable Rides) #shorts,wvtfA9J-UpE,2025-11-26T17:13:44Z,UCGT7T2ngAjrsTk3PI8o85tA,1547,uber hotspots secret locations for profitable rides shorts,8,False
How to Find the Best Cherry-Picking Locations in Any City 🚗💨 EP.19 [ Part 3 ],oFr6ga1Pp48,2025-11-25T14:00:06Z,UCGT7T2ngAjrsTk3PI8o85tA,6548,how to find the best cherry picking locations in any city ep 19 part 3,15,False
BEST way to BEAT the GREEDY UBER Algorithm! #shorts,-ABH3mtwbqg,2025-11-20T07:55:51Z,UCGT7T2ngAjrsTk3PI8o85tA,1334,best way to beat the greedy uber algorithm shorts,9,False
Uber Throttling: Fight Back! Smart Driver Strategies #shorts,cN-nxNIkil0,2025-11-19T14:00:59Z,UCGT7T2ngAjrsTk3PI8o85tA,1506,uber throttling fight back smart driver strategies shorts,8,False
Uber & Lyft Algorithm ( The Crazy App Reset Trick ) #shorts,6-WLM_giR2U,2025-11-18T13:54:47Z,UCGT7T2ngAjrsTk3PI8o85tA,2619,uber lyft algorithm the crazy app reset trick shorts,9,False
Maximize Uber Earnings: Expert Tips to Boost Ride Profits Now! #shorts,Ewwpq95Y9gQ,2025-11-17T14:00:25Z,UCGT7T2ngAjrsTk3PI8o85tA,1220,maximize uber earnings expert tips to boost ride profits now shorts,11,False
Uber Drivers HOW to AVOID AIRPORT THROTTLING with This Secret Trick! #shorts,sPGVhsx_DOg,2025-11-16T19:37:15Z,UCGT7T2ngAjrsTk3PI8o85tA,2578,uber drivers how to avoid airport throttling with this secret trick shorts,12,False
Uber is Manipulating Drivers for Maximum Profit! #shorts,gHjnWgELSJg,2025-11-15T13:59:36Z,UCGT7T2ngAjrsTk3PI8o85tA,2374,uber is manipulating drivers for maximum profit shorts,8,False
Uber Drivers This is HOW to BEAT the ALGO & Make More Money! #shorts,N0IeLWnjHSw,2025-11-14T14:19:01Z,UCGT7T2ngAjrsTk3PI8o85tA,1958,uber drivers this is how to beat the algo make more money shorts,13,False
HOW to BEAT the UBER ALGO & EARN More! #shorts,TTl26tPLqgw,2025-11-13T14:11:57Z,UCGT7T2ngAjrsTk3PI8o85tA,1680,how to beat the uber algo earn more shorts,9,False
How They Control Driver Earnings (Uber's Secrets ) #shorts,kT8Xxrd_l0g,2025-11-12T18:58:11Z,UCGT7T2ngAjrsTk3PI8o85tA,3213,how they control driver earnings uber s secrets shorts,9,False
How UBER Algorithm CONTROLS Your Earnings? Hidden Secrets #shorts,H1TWw57o3FQ,2025-11-10T13:57:56Z,UCGT7T2ngAjrsTk3PI8o85tA,2371,how uber algorithm controls your earnings hidden secrets shorts,9,False
How UBER and LYFT Throttle You! #shorts,e0UPSpTjrnY,2025-11-09T21:34:18Z,UCGT7T2ngAjrsTk3PI8o85tA,1453,how uber and lyft throttle you shorts,7,False
How The FUBER Algorithm Plays Chess with YOU #shorts,6bCHHrKmaAE,2025-11-07T14:12:50Z,UCGT7T2ngAjrsTk3PI8o85tA,1294,how the fuber algorithm plays chess with you shorts,9,False
Signs You're Being Punished by UBER (Uber Throttling EXPOSED) #shorts,OxlVjR7JNzk,2025-11-06T19:21:27Z,UCGT7T2ngAjrsTk3PI8o85tA,2176,signs you re being punished by uber uber throttling exposed shorts,11,False
How to Spot UBER THROTTLING & Beat the Algorithm! #shorts,ejib5iakqG8,2025-11-05T13:50:00Z,UCGT7T2ngAjrsTk3PI8o85tA,1664,how to spot uber throttling beat the algorithm shorts,9,False
Why UBER is Throttling YOU (and LYFT) #shorts,ag_NH532LqE,2025-11-04T15:40:57Z,UCGT7T2ngAjrsTk3PI8o85tA,1305,why uber is throttling you and lyft shorts,8,False
How Uber Slashes Driver Earnings! (Uber Throttling) #shorts,6932DsGw0g4,2025-11-04T01:34:53Z,UCGT7T2ngAjrsTk3PI8o85tA,2387,how uber slashes driver earnings uber throttling shorts,8,False
Uber Throttling EXPOSED (How to Beat the Fuber Algorithm) #shorts,a1OqTQoAaQ0,2025-11-03T14:33:53Z,UCGT7T2ngAjrsTk3PI8o85tA,2096,uber throttling exposed how to beat the fuber algorithm shorts,10,False
How Uber Throttles Drivers & Slows You Down (and 9 Tricks to Fix It) 🚗💨 EP.18 [ Part 1 ],nILxgOKwXt8,2025-11-03T13:00:06Z,UCGT7T2ngAjrsTk3PI8o85tA,18608,how uber throttles drivers slows you down and 9 tricks to fix it ep 18 part 1,17,False
Uber Strategy: How I Made $34 in 32 Minutes! #shorts,u_Vm9M5biqU,2025-11-02T18:16:19Z,UCGT7T2ngAjrsTk3PI8o85tA,1202,uber strategy how i made 34 in 32 minutes shorts,10,False
Jab to Hook: How I Made $34 on ONE Uber Ride! #shorts,wB0V1odqaVI,2025-10-28T15:57:32Z,UCGT7T2ngAjrsTk3PI8o85tA,884,jab to hook how i made 34 on one uber ride shorts,12,False
Uber Ride Made Me $62 In 50 Minutes! (Tips) #shorts,Ya9BPJSQbxs,2025-10-27T17:35:51Z,UCGT7T2ngAjrsTk3PI8o85tA,1192,uber ride made me 62 in 50 minutes tips shorts,10,False
"Make $60+/Hour: Brand, Business Cards, Passenger Secrets! #shorts",lIlb33JnU2E,2025-10-25T13:16:15Z,UCGT7T2ngAjrsTk3PI8o85tA,1175,make 60 hour brand business cards passenger secrets shorts,9,False
From Uber to Private Driving (How to Make More Money ) #shorts,npkfedaehbc,2025-10-24T13:11:43Z,UCGT7T2ngAjrsTk3PI8o85tA,1274,from uber to private driving how to make more money shorts,11,False
Drive Smarter Not Harder ( Uber Strategy for Getting Paid to Move ) #shorts,t5_TtoK913M,2025-10-23T23:58:59Z,UCGT7T2ngAjrsTk3PI8o85tA,1351,drive smarter not harder uber strategy for getting paid to move shorts,12,False
My Uber Strategy for Airport Rides #shorts,-4u3qsOYsGM,2025-10-23T13:10:55Z,UCGT7T2ngAjrsTk3PI8o85tA,920,my uber strategy for airport rides shorts,7,False
Uber Driver's Strategy: 2 Goals to Maximize Earnings #shorts,P_BVoRm4Su4,2025-10-22T13:03:07Z,UCGT7T2ngAjrsTk3PI8o85tA,1054,uber driver s strategy 2 goals to maximize earnings shorts,10,False
"Uber Boxing: Jab, Jab, Hook Strategy Explained #shorts",dfqjM9cdbPk,2025-10-21T15:03:24Z,UCGT7T2ngAjrsTk3PI8o85tA,934,uber boxing jab jab hook strategy explained shorts,8,False
Uber/Lyft Strategy: $170 in 7 Rides - No Grinding! #shorts,yuuvuVJeKWE,2025-10-21T00:57:59Z,UCGT7T2ngAjrsTk3PI8o85tA,1278,uber lyft strategy 170 in 7 rides no grinding shorts,10,False
"Uber Secret: $170 in 7 Trips with Jab, Jab, Hook #shorts",OrVSg6iXUes,2025-10-20T14:25:38Z,UCGT7T2ngAjrsTk3PI8o85tA,1078,uber secret 170 in 7 trips with jab jab hook shorts,11,False
How to Outsmart Uber’s Algorithm in 2025 (Step-by-Step) 🚗💨 EP.17 [ Part 1 ],ZTKepKyxeSE,2025-10-20T13:00:06Z,UCGT7T2ngAjrsTk3PI8o85tA,5755,how to outsmart uber s algorithm in 2025 step by step ep 17 part 1,15,False
Uber & Lyft Tips (How Much Do Drivers REALLY Make?) #shorts,43j67ZQ0Bgc,2025-10-20T12:48:29Z,UCGT7T2ngAjrsTk3PI8o85tA,830,uber lyft tips how much do drivers really make shorts,10,False
Manifesting $100 Tip: My Amazing Uber Driver Story #shorts,8p16l8w8aXA,2025-10-20T02:01:01Z,UCGT7T2ngAjrsTk3PI8o85tA,725,manifesting 100 tip my amazing uber driver story shorts,9,False
Can Uber Driver's Earn $100K Per Year (Is It Possible?) #shorts,t-rbkJuenuk,2025-10-19T18:40:22Z,UCGT7T2ngAjrsTk3PI8o85tA,823,can uber driver s earn 100k per year is it possible shorts,12,False
Cancel Rides & Make More Money! (Uber Driver Secrets) #shorts,t5rbuO2kf7k,2025-10-18T12:55:13Z,UCGT7T2ngAjrsTk3PI8o85tA,2708,cancel rides make more money uber driver secrets shorts,9,False
Uber & Lyft Drivers: Should You Rent or Own? #shorts,hlyj7xj0Fs4,2025-10-17T23:56:02Z,UCGT7T2ngAjrsTk3PI8o85tA,1483,uber lyft drivers should you rent or own shorts,9,False
Renting vs. Owning (What is Better for Rideshare?) #shorts,hLneKpYdeQA,2025-10-17T14:11:53Z,UCGT7T2ngAjrsTk3PI8o85tA,1133,renting vs owning what is better for rideshare shorts,9,False
Tipping Truths (What African Americans & Pagans Know) #shorts,GOSGeUoAtwE,2025-10-15T13:32:03Z,UCGT7T2ngAjrsTk3PI8o85tA,385,tipping truths what african americans pagans know shorts,8,False
How to Get Better Tips From Passengers ( Tipping Secrets ) #shorts,FKUtwZMq698,2025-10-14T16:05:18Z,UCGT7T2ngAjrsTk3PI8o85tA,797,how to get better tips from passengers tipping secrets shorts,10,False
How 2 Make More MONEY with TIPS (Airport Ride Secret) #shorts,eNIyQpLxeRk,2025-10-13T13:01:57Z,UCGT7T2ngAjrsTk3PI8o85tA,1065,how 2 make more money with tips airport ride secret shorts,11,False
"Private Rides (Jokes, Karaoke, = BIG Tips) #shorts",VqO3YKIKJIg,2025-10-12T18:55:50Z,UCGT7T2ngAjrsTk3PI8o85tA,722,private rides jokes karaoke big tips shorts,7,False
How I Choose Rides for Maximum Profit (Uber Driver Secrets) #shorts,AGSqCvRx8kY,2025-10-11T00:22:23Z,UCGT7T2ngAjrsTk3PI8o85tA,1473,how i choose rides for maximum profit uber driver secrets shorts,11,False
How to Analyze Fares FAST (Uber & Lyft Rides) #shorts,10EOVQwT-7g,2025-10-09T23:17:32Z,UCGT7T2ngAjrsTk3PI8o85tA,1545,how to analyze fares fast uber lyft rides shorts,9,False
LGBTQ+ Rider Gave a HUGE Tip! Comfort Ride #shorts,aTICoOtMM-E,2025-10-07T16:17:52Z,UCGT7T2ngAjrsTk3PI8o85tA,915,lgbtq rider gave a huge tip comfort ride shorts,9,False
Private Driver's BIG Tip: Why Clients Trust Me #shorts,780YZSXa4Q4,2025-10-07T00:36:19Z,UCGT7T2ngAjrsTk3PI8o85tA,1025,private driver s big tip why clients trust me shorts,10,False
UBER TIP (How Early Communication Boosts Earnings!) #shorts,skE8mJrns0M,2025-10-06T13:11:03Z,UCGT7T2ngAjrsTk3PI8o85tA,752,uber tip how early communication boosts earnings shorts,8,False
Uber/Doordash algorithm exposed by DRUNK backend engineer?!,5UJTsdxYJu4,2026-01-04T19:11:17Z,UCJVuRtReL3ZQRG5KvFRCqgA,682,uber doordash algorithm exposed by drunk backend engineer,8,False
LIVE UBERING DURING HUGE BLIZZARD,xmddA6s6mds,2025-12-29T15:41:43Z,UCJVuRtReL3ZQRG5KvFRCqgA,210,live ubering during huge blizzard,5,False
Uber driving during a BLIZZARD,iMWrdk63jF4,2025-12-29T02:44:57Z,UCJVuRtReL3ZQRG5KvFRCqgA,88,uber driving during a blizzard,5,False
Pelsee S12 Pro Dashcam boasts incredible FULL COLOR night vision technology #dashcam #cars #s12pro,0A_-0RHpU7M,2025-11-25T03:49:59Z,UCJVuRtReL3ZQRG5KvFRCqgA,3007,pelsee s12 pro dashcam boasts incredible full color night vision technology dashcam cars s12pro,14,False
Love using iPad CarPlay in my car 🚗 🔥 #carplay #mounts #apple,_rfudsRLhdU,2025-11-22T22:31:22Z,UCJVuRtReL3ZQRG5KvFRCqgA,2498,love using ipad carplay in my car carplay mounts apple,10,False
Uber & Lyft Split Screen on iPad (2026),0xb279sGJ94,2025-11-18T15:46:44Z,UCJVuRtReL3ZQRG5KvFRCqgA,543,uber lyft split screen on ipad 2026,7,False
Here’s another Uber Black SUV 🔥 #uberblack #uber #lyft,Pvx0YIpg8Fc,2025-11-06T13:51:57Z,UCJVuRtReL3ZQRG5KvFRCqgA,1826,here s another uber black suv uberblack uber lyft,9,False
Would yall do this Uber Black SUV ride? #uber #lyft #rideshare,QJpT-XWFeZI,2025-11-06T13:49:59Z,UCJVuRtReL3ZQRG5KvFRCqgA,5420,would yall do this uber black suv ride uber lyft rideshare,11,False
Uber Black SUV pay 💵 Part 8 #uberblack #suv #earnings,3TOxs_FGjUA,2025-11-02T13:00:10Z,UCJVuRtReL3ZQRG5KvFRCqgA,1665,uber black suv pay part 8 uberblack suv earnings,9,False
Uber Black SUV pay 💵 Part 7 #uberblack #suv #earnings,zaeCTSU5m0g,2025-11-02T12:01:49Z,UCJVuRtReL3ZQRG5KvFRCqgA,2050,uber black suv pay part 7 uberblack suv earnings,9,False
Uber Black SUV pay 💵 Part 6 #uberblack #suv #earnings,CgbNlxYjqys,2025-11-02T11:00:32Z,UCJVuRtReL3ZQRG5KvFRCqgA,1550,uber black suv pay part 6 uberblack suv earnings,9,False
Uber Black SUV pay 💰 Part 5 #uberblack #suv #earnings,aoIPRULG2gc,2025-11-02T05:00:05Z,UCJVuRtReL3ZQRG5KvFRCqgA,1497,uber black suv pay part 5 uberblack suv earnings,9,False
Uber Black SUV pay 💵 Part 4 #uberblack #suv #earnings,qSDd4Sdp27g,2025-11-02T03:01:09Z,UCJVuRtReL3ZQRG5KvFRCqgA,1188,uber black suv pay part 4 uberblack suv earnings,9,False
Crazy surges on Uber Black in Dallas 🔥 #uber #lyft #black,9WL4f_hErtE,2025-11-01T19:00:08Z,UCJVuRtReL3ZQRG5KvFRCqgA,1521,crazy surges on uber black in dallas uber lyft black,10,False
Uber Black SUV pay 💰 Part 3 #uberblack #suv #pay,kBzi0WblPF4,2025-11-01T18:36:34Z,UCJVuRtReL3ZQRG5KvFRCqgA,1450,uber black suv pay part 3 uberblack suv pay,9,False
Uber Black SUV pay 💰 Part 2 #uberblack #suv #pay,dqZdsjmS3qk,2025-11-01T18:33:03Z,UCJVuRtReL3ZQRG5KvFRCqgA,1906,uber black suv pay part 2 uberblack suv pay,9,False
Uber Black SUV pay 💰 Part 1 #uber #black #pay,qB63jvxq79A,2025-11-01T18:31:19Z,UCJVuRtReL3ZQRG5KvFRCqgA,415,uber black suv pay part 1 uber black pay,9,False
I really do love iPad CarPlay 🤫 #tech #apple #carplay,GpmL8ssGeqY,2025-10-28T18:50:23Z,UCJVuRtReL3ZQRG5KvFRCqgA,4132,i really do love ipad carplay tech apple carplay,9,False
Uber waiting lot is full: A problem ,jKhXNYDJyeM,2025-10-24T21:15:03Z,UCJVuRtReL3ZQRG5KvFRCqgA,381,uber waiting lot is full a problem,7,False
Uber & Lyft airport lot raids all over the US,NuhC8d0lu34,2025-10-23T18:30:34Z,UCJVuRtReL3ZQRG5KvFRCqgA,243,uber lyft airport lot raids all over the us,9,False
Is Uber & Lyft still worth it? ,Vb6c0LhS83M,2025-10-21T23:30:15Z,UCJVuRtReL3ZQRG5KvFRCqgA,1387,is uber lyft still worth it,6,False
iPad CarPlay? Here’s how to easily do it,FRXa_T88-YQ,2025-10-21T22:30:07Z,UCJVuRtReL3ZQRG5KvFRCqgA,8601,ipad carplay here s how to easily do it,9,False
iPad CarPlay is so much better and faster than yalls normal car screens 😩🔥,CU_4BDe-fTw,2025-10-21T15:02:27Z,UCJVuRtReL3ZQRG5KvFRCqgA,1572,ipad carplay is so much better and faster than yalls normal car screens,13,False
install iPad in your car like CarPlay 👀,UAdV5gwDOFI,2025-10-20T21:56:18Z,UCJVuRtReL3ZQRG5KvFRCqgA,9765,install ipad in your car like carplay,7,False
"yup this is it, i found the best phone mount |  LISEN SuctionPro Phone Holder🔥 @LisenTech",58NflwPkvJg,2025-10-20T20:17:08Z,UCJVuRtReL3ZQRG5KvFRCqgA,1640,yup this is it i found the best phone mount lisen suctionpro phone holder lisentech,15,False
AWS may be down but I can at least watch movies on my iPad in my car 😂🔥 #tech #carplay #crashed,YsXoQwwz-is,2025-10-20T15:25:50Z,UCJVuRtReL3ZQRG5KvFRCqgA,1615,aws may be down but i can at least watch movies on my ipad in my car tech carplay crashed,20,False
Should Lyft Black SUV pay less or more? #uber #lyft,ZiKAN9RgSc8,2025-10-16T21:28:23Z,UCJVuRtReL3ZQRG5KvFRCqgA,3485,should lyft black suv pay less or more uber lyft,10,False
iPad CarPlay is tuff 🔥 #tech #ipad #cartechnology,6osVIH7uy84,2025-10-16T21:13:00Z,UCJVuRtReL3ZQRG5KvFRCqgA,3316,ipad carplay is tuff tech ipad cartechnology,7,False
Uber & Lyft during government shutdown,wpNrxMSSDj8,2025-10-15T22:45:16Z,UCJVuRtReL3ZQRG5KvFRCqgA,112,uber lyft during government shutdown,5,False
"If it wasn’t for the tip on the Lyft XL, it would have been terrible 😭 #uber #lyft #rideshare",f6egNF4RmsY,2025-10-15T19:00:01Z,UCJVuRtReL3ZQRG5KvFRCqgA,1799,if it wasn t for the tip on the lyft xl it would have been terrible uber lyft rideshare,19,False
these Uber surges are crazy 🔥 #uber #lyft #pay,Oep2cP5xv2Y,2025-10-15T01:50:03Z,UCJVuRtReL3ZQRG5KvFRCqgA,1625,these uber surges are crazy uber lyft pay,8,False
Uber Black SUV pay is something else.,gMeI77Gf16I,2025-10-15T01:11:10Z,UCJVuRtReL3ZQRG5KvFRCqgA,3886,uber black suv pay is something else,7,False
Lyft Black SUV did good tonight 🔥#uber #lyft #pay,G0ra9PJaAf4,2025-10-14T03:16:28Z,UCJVuRtReL3ZQRG5KvFRCqgA,1808,lyft black suv did good tonight uber lyft pay,9,False
What do you think about this Uber Black SUV ride? #uber #rideshare #lyft,AF5GviJixhE,2025-10-13T23:41:27Z,UCJVuRtReL3ZQRG5KvFRCqgA,1321,what do you think about this uber black suv ride uber rideshare lyft,13,False
"Here’s a good Uber Black SUV ride, traffic was something for sure 😭 #Uber #Lyft #rideshare",8JVZc01Vvqw,2025-10-13T23:38:32Z,UCJVuRtReL3ZQRG5KvFRCqgA,1282,here s a good uber black suv ride traffic was something for sure uber lyft rideshare,16,False
"Uber Black in Dallas, what do you guys think? #uber #lyft #rideshare",J1hq74V8_VU,2025-10-13T23:26:55Z,UCJVuRtReL3ZQRG5KvFRCqgA,2885,uber black in dallas what do you guys think uber lyft rideshare,12,False
would yall take this Lyft black SUV ride?! let me know!! @Lyft #lyft #uber #rideshare 🔥,jhEVYAWnCCM,2025-10-13T03:48:26Z,UCJVuRtReL3ZQRG5KvFRCqgA,1731,would yall take this lyft black suv ride let me know lyft lyft uber rideshare,15,False
INSANE uber black suv ride 🔥 #uber #lyft #earnings #pay,FaMIFxCvb4Y,2025-10-13T03:29:45Z,UCJVuRtReL3ZQRG5KvFRCqgA,1375,insane uber black suv ride uber lyft earnings pay,9,False
had these Uber Black SUV rides all night. 🔥 #uberblack #lyftblack,3GauE8zRp2Y,2025-10-13T03:01:39Z,UCJVuRtReL3ZQRG5KvFRCqgA,7496,had these uber black suv rides all night uberblack lyftblack,10,False
Favorite thing about installing an iPad in my car honestly 😂🔥,y6sbsEZK6JM,2025-10-10T00:09:29Z,UCJVuRtReL3ZQRG5KvFRCqgA,1683,favorite thing about installing an ipad in my car honestly,10,False
Don’t need CarPlay anymore / Split screen Uber & Lyft #uber #lyft #tech #ipad,LcwVLAF-gjU,2025-10-07T18:53:20Z,UCJVuRtReL3ZQRG5KvFRCqgA,1422,don t need carplay anymore split screen uber lyft uber lyft tech ipad,13,False
Start of the night on uber and Lyft split screen in the iPad 🔥,P5Py6bOwR0w,2025-10-07T02:43:04Z,UCJVuRtReL3ZQRG5KvFRCqgA,3202,start of the night on uber and lyft split screen in the ipad,13,False
early morning uber/lyft shift #pay #earnings #rideshare,-_xiwCAvabs,2025-09-30T10:27:55Z,UCJVuRtReL3ZQRG5KvFRCqgA,3691,early morning uber lyft shift pay earnings rideshare,8,False
should I take this Lyft ride? #uber #lyft #rideshare,q11JXr-Mtbw,2025-09-29T20:57:15Z,UCJVuRtReL3ZQRG5KvFRCqgA,2376,should i take this lyft ride uber lyft rideshare,9,False
AMAZING Uber Black SUV ride 😎,wB8YKe7E0HQ,2025-09-18T18:07:48Z,UCJVuRtReL3ZQRG5KvFRCqgA,1759,amazing uber black suv ride,5,False
Uber Black SUV fire ride 🔥🔥 #uber #lyft #rideshare,nMHfxth9y-o,2025-09-17T00:39:10Z,UCJVuRtReL3ZQRG5KvFRCqgA,1722,uber black suv fire ride uber lyft rideshare,8,False
How to CarPlay with iPad? This method is 100x better 🔥 #tech #ipad #carplay,DMX8gsFVSWE,2025-09-16T19:24:45Z,UCJVuRtReL3ZQRG5KvFRCqgA,26175,how to carplay with ipad this method is 100x better tech ipad carplay,13,False
Lyft introduces NEW AI feature for drivers. Will it actually help? #lyft #uber #rideshare,UXgifssj9Dk,2025-09-15T21:40:34Z,UCJVuRtReL3ZQRG5KvFRCqgA,1999,lyft introduces new ai feature for drivers will it actually help lyft uber rideshare,14,False
LIVE uber & lyft ride along with earnings/pay,h8UVUuOaZhU,2025-09-15T06:08:21Z,UCJVuRtReL3ZQRG5KvFRCqgA,236,live uber lyft ride along with earnings pay,8,False
mounted iPad in the car now I feel like I never need a new car 🔥 #tech #carplay #ipad,eeMYPp8w-18,2025-09-14T21:15:12Z,UCJVuRtReL3ZQRG5KvFRCqgA,1455,mounted ipad in the car now i feel like i never need a new car tech carplay ipad,18,False
iPad CarPlay is better than Apple CarPlay #tech #ipad #car,rFnJVb6gOlQ,2025-09-14T00:27:30Z,UCJVuRtReL3ZQRG5KvFRCqgA,1054,ipad carplay is better than apple carplay tech ipad car,10,False
pov: u installed an ipad in your car 🔥 #tech #carplay #ipad,-l_mcnh0DS8,2025-09-12T21:51:30Z,UCJVuRtReL3ZQRG5KvFRCqgA,1174,pov u installed an ipad in your car tech carplay ipad,11,False
uber & lyft daily earnings today 😗 #rideshare #uber #lyft,M_f_zcahsQY,2025-09-12T21:23:44Z,UCJVuRtReL3ZQRG5KvFRCqgA,930,uber lyft daily earnings today rideshare uber lyft,8,False
typical slow wednesday doing uber & lyft #rideshare #uber #lyft,6vFGWwWDmt8,2025-09-11T00:26:38Z,UCJVuRtReL3ZQRG5KvFRCqgA,1024,typical slow wednesday doing uber lyft rideshare uber lyft,9,False
TRUTH about renting a car on uber & lyft,Vpoy_plGFi4,2025-09-10T17:00:47Z,UCJVuRtReL3ZQRG5KvFRCqgA,5356,truth about renting a car on uber lyft,8,False
what i hate about being an uber & lyft driver,WzsIVba5wRE,2025-09-10T01:30:24Z,UCJVuRtReL3ZQRG5KvFRCqgA,269,what i hate about being an uber lyft driver,9,False
favorite types of Uber Black SUV rides 😉 #uber #lyft #rideshare,xg6KVKY2Gcw,2025-09-09T23:25:50Z,UCJVuRtReL3ZQRG5KvFRCqgA,1142,favorite types of uber black suv rides uber lyft rideshare,10,False
would yall do this Uber Black SUV hourly? #uber #lyft #blacksuv #rideshare,CpYh21-HDeM,2025-09-09T23:18:12Z,UCJVuRtReL3ZQRG5KvFRCqgA,1898,would yall do this uber black suv hourly uber lyft blacksuv rideshare,12,False
