text_videotitle,video_id,published_at,channel_id,video_viewcount,title_clean,title_wordcount,is_date_like
minimum fare strategy for Uber driving,Ln7vPdMohQw,2025-09-28T13:11:59Z,UCKFWaKjqvd7N2ZLO_hdzOJg,450,minimum fare strategy for uber driving,6,False
I use AI to boost my Uber driver earnings,qIV6LW0mLD4,2025-09-28T09:02:04Z,UCKFWaKjqvd7N2ZLO_hdzOJg,311,i use ai to boost my uber driver earnings,9,False
"2 hours Uber on a Saturday night, I've had enough and going home",LXi20LCgOg4,2025-09-27T18:53:42Z,UCKFWaKjqvd7N2ZLO_hdzOJg,1048,2 hours uber on a saturday night i ve had enough and going home,14,False
where is Uber advertising?,3XM3BwQ9Ftg,2025-09-27T18:03:17Z,UCKFWaKjqvd7N2ZLO_hdzOJg,894,where is uber advertising,4,False
September EV Charging News,uWI8rMwj6d4,2025-09-27T16:19:45Z,UCKFWaKjqvd7N2ZLO_hdzOJg,99,september ev charging news,4,False
Friday fun shift on Uber and personal work,CQ0buNu1jG0,2025-09-26T22:36:38Z,UCKFWaKjqvd7N2ZLO_hdzOJg,163,friday fun shift on uber and personal work,8,False
give it a good push 😅😅😅,gxWVIZZQwf8,2025-09-26T16:19:23Z,UCKFWaKjqvd7N2ZLO_hdzOJg,1194,give it a good push,5,False
cross border hiring consultation update,WLJsPnYXwHY,2025-09-25T07:10:43Z,UCKFWaKjqvd7N2ZLO_hdzOJg,279,cross border hiring consultation update,5,False
no more Uber comfort in Newport 🤬🤬,LvDrs-uHJsU,2025-09-23T14:43:39Z,UCKFWaKjqvd7N2ZLO_hdzOJg,1117,no more uber comfort in newport,6,False
why we need more and faster ultra charging hubs #ev #evcharging #ionity,RBbDzX7eO2M,2025-09-23T10:20:29Z,UCKFWaKjqvd7N2ZLO_hdzOJg,1127,why we need more and faster ultra charging hubs ev evcharging ionity,12,False
episode 10 of road rage attack at Newport Railway Station,vrHkf76-KFw,2025-09-22T18:25:40Z,UCKFWaKjqvd7N2ZLO_hdzOJg,875,episode 10 of road rage attack at newport railway station,10,False
how did I become a gold uber driver?,QgG_Cf5VSLg,2025-09-20T16:23:27Z,UCKFWaKjqvd7N2ZLO_hdzOJg,1667,how did i become a gold uber driver,8,False
"Ioniq 5 Review after 100,000 miles",PMc_vlOSbHs,2025-09-19T22:17:32Z,UCKFWaKjqvd7N2ZLO_hdzOJg,437,ioniq 5 review after 100 000 miles,7,False
the joys of EV ownership as taxi driver,sdTmeKEBh3I,2025-09-19T09:28:54Z,UCKFWaKjqvd7N2ZLO_hdzOJg,1083,the joys of ev ownership as taxi driver,8,False
why do uber try and hide school runs we fake addresses,4wfVkC8jm58,2025-09-18T13:58:01Z,UCKFWaKjqvd7N2ZLO_hdzOJg,1150,why do uber try and hide school runs we fake addresses,11,False
update 9 of road rage attack at Newport Railway Station,pmeP1PJnZsc,2025-09-17T12:54:23Z,UCKFWaKjqvd7N2ZLO_hdzOJg,903,update 9 of road rage attack at newport railway station,10,False
Uber earnings analysis from tip you in the app,u2TGq4M9Tbg,2025-09-17T08:56:42Z,UCKFWaKjqvd7N2ZLO_hdzOJg,278,uber earnings analysis from tip you in the app,9,False
Bristol airport looking for new taxi provider,GDpN__eNBXA,2025-09-16T15:34:10Z,UCKFWaKjqvd7N2ZLO_hdzOJg,254,bristol airport looking for new taxi provider,7,False
Uber Was Smoke in Mirrors on to next chapter,YtAAw3mhBmU,2025-07-08T22:27:49Z,UCeYkB1lrXkcegj7pbjTz93w,48,uber was smoke in mirrors on to next chapter,9,False
1 Uber Passenger Can Ruin Your Whole Life 🙆🏾‍♂️,-PClbgrr1Pg,2025-04-25T17:06:49Z,UCeYkB1lrXkcegj7pbjTz93w,74,1 uber passenger can ruin your whole life,8,False
Uber secret 1 #shorts,QM-YE4ngrAM,2025-04-15T04:46:32Z,UCeYkB1lrXkcegj7pbjTz93w,165,uber secret 1 shorts,4,False
I never seen this part of Philly when I was growing up,6vEs-2LiaS4,2025-04-13T12:21:57Z,UCeYkB1lrXkcegj7pbjTz93w,107,i never seen this part of philly when i was growing up,12,False
Life After Uber Was It All Worth It,KrQLQ1-Gzb4,2025-04-03T22:43:28Z,UCeYkB1lrXkcegj7pbjTz93w,379,life after uber was it all worth it,8,False
DoorDashing vs Uber Driving What Make Most Money #shorts,FFHcK5zmanI,2025-03-30T20:22:15Z,UCeYkB1lrXkcegj7pbjTz93w,622,doordashing vs uber driving what make most money shorts,9,False
Philly Uber/Lyft Map Where To Go and Places To Avoid,CdbgIs2Chsw,2025-03-29T20:20:54Z,UCeYkB1lrXkcegj7pbjTz93w,492,philly uber lyft map where to go and places to avoid,11,False
Uber and Lyft Drivers Need To Get A Real Job!,Txaj_fFbHGU,2025-03-27T14:12:21Z,UCeYkB1lrXkcegj7pbjTz93w,1484,uber and lyft drivers need to get a real job,10,False
You Better Keep This On You If You Drive Uber And Lyft Full Time,7p9eFRnjJp8,2025-03-20T15:12:28Z,UCeYkB1lrXkcegj7pbjTz93w,144,you better keep this on you if you drive uber and lyft full time,14,False
I got into a car accident it's over,EYcTlspR4vQ,2025-03-20T01:30:22Z,UCeYkB1lrXkcegj7pbjTz93w,407,i got into a car accident it s over,9,False
Uber Drivers Hear It All #shorts,5pAIaCLwAKI,2025-03-19T11:02:49Z,UCeYkB1lrXkcegj7pbjTz93w,573,uber drivers hear it all shorts,6,False
beyond political #shorts,9U2qfv5g4hg,2025-03-18T05:07:02Z,UCeYkB1lrXkcegj7pbjTz93w,163,beyond political shorts,3,False
You going In There #shorts,-jQB8vdufXU,2025-03-16T17:00:29Z,UCeYkB1lrXkcegj7pbjTz93w,412,you going in there shorts,5,False
If Uber Told You The Truth #shorts,dS62syCdQ4o,2025-03-14T00:54:46Z,UCeYkB1lrXkcegj7pbjTz93w,413,if uber told you the truth shorts,7,False
1st honest Tesla Review #shorts,KGydeD1a6vs,2025-03-13T20:46:00Z,UCeYkB1lrXkcegj7pbjTz93w,435,1st honest tesla review shorts,5,False
Give her credit #shorts,hCcKVrKXOfc,2025-03-12T16:00:03Z,UCeYkB1lrXkcegj7pbjTz93w,9,give her credit shorts,4,False
I made a cartoon about Uber Rideshare Careers,bduoPd6pIAI,2025-03-11T21:50:45Z,UCeYkB1lrXkcegj7pbjTz93w,45,i made a cartoon about uber rideshare careers,8,False
Market Crash 2025 #shorts,ok_4vEEqRgo,2025-03-11T02:49:35Z,UCeYkB1lrXkcegj7pbjTz93w,109,market crash 2025 shorts,4,False
Elon Musk big-time loss #shorts,DJZ9mPYH0HA,2025-03-11T02:23:31Z,UCeYkB1lrXkcegj7pbjTz93w,13,elon musk big time loss shorts,6,False
Turn her TV off #shorts,auc_XdzIfjE,2025-03-11T01:00:57Z,UCeYkB1lrXkcegj7pbjTz93w,64,turn her tv off shorts,5,False
In to deep already #shorts,6hticEyLKDM,2025-03-10T19:37:06Z,UCeYkB1lrXkcegj7pbjTz93w,60,in to deep already shorts,5,False
She gone fight her #shorts,e_DoGgtF2Yg,2025-03-10T17:47:21Z,UCeYkB1lrXkcegj7pbjTz93w,8,she gone fight her shorts,5,False
When People First Learn About Crypto 😭,OX3anMtcKj0,2025-03-10T17:38:37Z,UCeYkB1lrXkcegj7pbjTz93w,38,when people first learn about crypto,6,False
Crypto Summit Was Like #shorts,OC3zn4TTbn0,2025-03-08T12:41:03Z,UCeYkB1lrXkcegj7pbjTz93w,727,crypto summit was like shorts,5,False
It's Going To Be To late #shorts,-xKafNT4MTI,2025-03-08T04:21:07Z,UCeYkB1lrXkcegj7pbjTz93w,417,it s going to be to late shorts,8,False
So that's how you feel #shorts,Sr3p-kAYU0M,2025-03-07T20:18:22Z,UCeYkB1lrXkcegj7pbjTz93w,95,so that s how you feel shorts,7,False
Don't even panic #shorts,F8K7g8Z1hBE,2025-03-07T15:07:49Z,UCeYkB1lrXkcegj7pbjTz93w,373,don t even panic shorts,5,False
Graphs look scary #shorts,MA0U2hh_Ogk,2025-03-07T11:00:26Z,UCeYkB1lrXkcegj7pbjTz93w,42,graphs look scary shorts,4,False
Good or Bad Uber Ride #shorts,DIbYkhoavnE,2025-03-07T02:43:12Z,UCeYkB1lrXkcegj7pbjTz93w,505,good or bad uber ride shorts,6,False
Yes You Can Buy Good Credit #shorts,dR73I5LpPM4,2025-03-06T17:56:19Z,UCeYkB1lrXkcegj7pbjTz93w,6,yes you can buy good credit shorts,7,False
Finding A Profitable Crypto Coin #shorts,-9KcJOQJzsQ,2025-03-06T16:54:29Z,UCeYkB1lrXkcegj7pbjTz93w,58,finding a profitable crypto coin shorts,6,False
As A Non Crypto Person I Studied The Market For 6 Months I Learned,0iPsVn7rtJc,2025-03-06T11:27:06Z,UCeYkB1lrXkcegj7pbjTz93w,98,as a non crypto person i studied the market for 6 months i learned,14,False
Why I Don't Invest I Just Study The Crypto Market here's what I learned,ndgWDSk9lf4,2025-03-02T20:24:13Z,UCeYkB1lrXkcegj7pbjTz93w,25,why i don t invest i just study the crypto market here s what i learned,16,False
You Got To Do What You Have To Do #shorts,s3xpxeYoXXA,2025-03-02T17:00:58Z,UCeYkB1lrXkcegj7pbjTz93w,411,you got to do what you have to do shorts,10,False
Why your Uber Driver Really Wear A Mask,CvMxo8JJAIA,2025-03-02T16:00:23Z,UCeYkB1lrXkcegj7pbjTz93w,550,why your uber driver really wear a mask,8,False
She not gone last #shorts,1ri_lPszaUA,2025-03-02T12:30:20Z,UCeYkB1lrXkcegj7pbjTz93w,551,she not gone last shorts,5,False
Disrespectful Uber Driver Might Definitely Get Deactivated For This,ZsGJgrPXT0Y,2025-03-02T12:19:16Z,UCeYkB1lrXkcegj7pbjTz93w,777,disrespectful uber driver might definitely get deactivated for this,9,False
Passengers Can Be Disrespectful A Uber Ride I Regret,kzf0v9btmp4,2025-03-02T00:46:35Z,UCeYkB1lrXkcegj7pbjTz93w,62,passengers can be disrespectful a uber ride i regret,9,False
Being a Uber Driver Would It Be Smart To Get NEW Car Or USED to Grind With,-eOGetI1IsY,2025-03-01T02:38:51Z,UCeYkB1lrXkcegj7pbjTz93w,265,being a uber driver would it be smart to get new car or used to grind with,17,False
Tips For Drivers #shorts,y4OIOsyHZXY,2025-02-28T14:17:33Z,UCeYkB1lrXkcegj7pbjTz93w,657,tips for drivers shorts,4,False
Crypto Market CRASH Is Great!,UwqORYINgaw,2025-02-28T07:10:55Z,UCeYkB1lrXkcegj7pbjTz93w,63,crypto market crash is great,5,False
This Not The 1900s You Can Just Buy Good Credit Now Literally This Easy,qMBSuxKzfwI,2025-02-27T20:35:48Z,UCeYkB1lrXkcegj7pbjTz93w,24,this not the 1900s you can just buy good credit now literally this easy,14,False
Don't Sleep On Used Cars They Made Me Bread #shorts,oTvJ2q8c7lY,2025-02-26T12:11:59Z,UCeYkB1lrXkcegj7pbjTz93w,60,don t sleep on used cars they made me bread shorts,11,False
Actual Credit Score Hacks That Work #shorts,i3xzQ93MqW0,2025-02-25T17:35:58Z,UCeYkB1lrXkcegj7pbjTz93w,31,actual credit score hacks that work shorts,7,False
After Doing Uber Over 3 Years How's I Treat Passengers Now,kLeoK-5zduo,2025-02-24T18:00:38Z,UCeYkB1lrXkcegj7pbjTz93w,196,after doing uber over 3 years how s i treat passengers now,12,False
Why Uber and DoorDash Pay Getting Worse And Miles Ridiculous,Ye8pl9WotWE,2025-02-24T08:58:53Z,UCeYkB1lrXkcegj7pbjTz93w,86,why uber and doordash pay getting worse and miles ridiculous,10,False
Bitcoin lies #shorts,Hf11pzw38NU,2025-02-19T17:37:50Z,UCeYkB1lrXkcegj7pbjTz93w,361,bitcoin lies shorts,3,False
Not for the lazy individuals #shorts,-d2i4t6fQDo,2025-02-19T11:48:03Z,UCeYkB1lrXkcegj7pbjTz93w,232,not for the lazy individuals shorts,6,False
Apocalypse while dashing #shorts,A1eXf-qlUqw,2025-02-17T06:19:01Z,UCeYkB1lrXkcegj7pbjTz93w,500,apocalypse while dashing shorts,4,False
DoorDash again #shorts,Ouc1ijDOrWA,2025-02-15T19:53:36Z,UCeYkB1lrXkcegj7pbjTz93w,512,doordash again shorts,3,False
You Won't Believe How Much I Made Doing DoorDash in Philadelphia Day 2,lcIEI-3l_qY,2025-02-15T17:14:20Z,UCeYkB1lrXkcegj7pbjTz93w,225,you won t believe how much i made doing doordash in philadelphia day 2,14,False
Philly what happened here #shorts,W9ETp6qf76g,2025-02-07T06:52:33Z,UCeYkB1lrXkcegj7pbjTz93w,573,philly what happened here shorts,5,False
Crypto World Understanding How Meme Coins Make Us Money,lQ_Zq57h0vM,2025-02-04T21:40:56Z,UCeYkB1lrXkcegj7pbjTz93w,92,crypto world understanding how meme coins make us money,9,False
"How To Make Money From Meme Coins ""CRYPTO MATH""",glmbkqoNu34,2025-02-01T19:25:09Z,UCeYkB1lrXkcegj7pbjTz93w,51,how to make money from meme coins crypto math,9,False
"What I'm Learning about Bitcoin, Crypto, Stocks and Meme Coin Culture",8Eit3xbdHiY,2025-01-25T19:18:17Z,UCeYkB1lrXkcegj7pbjTz93w,270,what i m learning about bitcoin crypto stocks and meme coin culture,12,False
Why philly uber drivers hate taking jersey Rides #shorts,rOZmbkG890Y,2025-01-04T18:48:52Z,UCeYkB1lrXkcegj7pbjTz93w,358,why philly uber drivers hate taking jersey rides shorts,9,False
Shared Rides Exposed #shorts,ii4U22OZofo,2025-01-04T18:23:53Z,UCeYkB1lrXkcegj7pbjTz93w,50,shared rides exposed shorts,4,False
My bad bro #shorts,flRwOnHITLw,2024-12-16T14:33:39Z,UCeYkB1lrXkcegj7pbjTz93w,522,my bad bro shorts,4,False
Your Uber Profile Hack Actually Works For Tips and Treatment from Passengers,hM9VOVxk94g,2024-12-11T16:10:23Z,UCeYkB1lrXkcegj7pbjTz93w,96,your uber profile hack actually works for tips and treatment from passengers,12,False
Assume the WORSE #shorts,sGp4c9RWI7w,2024-12-09T16:35:02Z,UCeYkB1lrXkcegj7pbjTz93w,72,assume the worse shorts,4,False
How tf you know #shorts,2-JTmQG7dY8,2024-12-09T15:49:23Z,UCeYkB1lrXkcegj7pbjTz93w,504,how tf you know shorts,5,False
Its always money out there #shorts,3KbCA9Cl5DI,2024-12-09T15:10:25Z,UCeYkB1lrXkcegj7pbjTz93w,73,its always money out there shorts,6,False
Uber 101 Top 5 Reasons Drivers Quit Or Make No Money,0rVNce01bnQ,2024-12-08T20:48:51Z,UCeYkB1lrXkcegj7pbjTz93w,618,uber 101 top 5 reasons drivers quit or make no money,11,False
Uber Money Breakdown #shorts,YZUN3SZi2Yg,2024-12-03T13:48:38Z,UCeYkB1lrXkcegj7pbjTz93w,131,uber money breakdown shorts,4,False
Uber Driver Earnings Breakdown FINALLY Questions Answered,fv6Qlj_jetY,2024-12-02T17:50:59Z,UCeYkB1lrXkcegj7pbjTz93w,821,uber driver earnings breakdown finally questions answered,7,False
2 Things That Help My Credit Go Up Every Single Month,KzHrCGJr_-U,2024-11-29T16:01:25Z,UCeYkB1lrXkcegj7pbjTz93w,28,2 things that help my credit go up every single month,11,False
Uber Eats Ride Along #shorts,m233wHb6UB4,2024-11-27T14:06:35Z,UCeYkB1lrXkcegj7pbjTz93w,604,uber eats ride along shorts,5,False
Dont even do uber if #shorts,UdnZhthPc-I,2024-11-27T13:38:49Z,UCeYkB1lrXkcegj7pbjTz93w,156,dont even do uber if shorts,6,False
Leave her alone #shorts,3tgPNhdPpJY,2024-11-27T13:28:37Z,UCeYkB1lrXkcegj7pbjTz93w,423,leave her alone shorts,4,False
Passenger Get Kicked Out Uber #shorts,TZc4YBDAmDc,2024-11-25T06:49:53Z,UCeYkB1lrXkcegj7pbjTz93w,663,passenger get kicked out uber shorts,6,False
Uber Eats Delivery Be Like #funny #ubereats #shorts,--u1SjLGBeU,2024-11-24T20:41:52Z,UCeYkB1lrXkcegj7pbjTz93w,2614,uber eats delivery be like funny ubereats shorts,8,False
OH What could it be #uberdriver #shorts,PVo9fGbVTu8,2024-11-24T15:26:21Z,UCeYkB1lrXkcegj7pbjTz93w,515,oh what could it be uberdriver shorts,7,False
CAN YOU POP THE TRUNK #shorts,GX4ZJ-1L4eA,2024-11-23T19:05:51Z,UCeYkB1lrXkcegj7pbjTz93w,419,can you pop the trunk shorts,6,False
Weird Question #shorts,3k3NZNj7LYM,2024-11-21T22:55:12Z,UCeYkB1lrXkcegj7pbjTz93w,590,weird question shorts,3,False
Uber Passengers Kicked out 1 to 5 🤣,VxfECB71zlc,2024-11-21T22:10:38Z,UCeYkB1lrXkcegj7pbjTz93w,1469,uber passengers kicked out 1 to 5,7,False
Thats 250 Baby #shorts,1Qj45kxItBg,2024-11-21T17:13:12Z,UCeYkB1lrXkcegj7pbjTz93w,478,thats 250 baby shorts,4,False
EXCUSE ME! #shorts,xb67af5vf34,2024-11-20T19:52:28Z,UCeYkB1lrXkcegj7pbjTz93w,455,excuse me shorts,3,False
What Charger Passengers 13 #shorts,94qC72J9wwA,2024-11-20T19:33:55Z,UCeYkB1lrXkcegj7pbjTz93w,451,what charger passengers 13 shorts,5,False
I know you effin lying #shorts,_zVsqYGYwqE,2024-11-20T19:08:22Z,UCeYkB1lrXkcegj7pbjTz93w,440,i know you effin lying shorts,6,False
She On The Phone Uber Passengers 11 #shorts,TVCI-sG-JTA,2024-11-20T18:50:37Z,UCeYkB1lrXkcegj7pbjTz93w,602,she on the phone uber passengers 11 shorts,8,False
No English Uber Passengers 10 #shorts,YxEICcXKXoQ,2024-11-20T18:37:26Z,UCeYkB1lrXkcegj7pbjTz93w,456,no english uber passengers 10 shorts,6,False
HOW MANY! Passengers 8 #uber #shorts,C_BMoCz4LDc,2024-11-19T14:33:27Z,UCeYkB1lrXkcegj7pbjTz93w,472,how many passengers 8 uber shorts,6,False
Passengers 7 Double Trouble #uber #shorts,VxeNSdaXilY,2024-11-19T14:02:32Z,UCeYkB1lrXkcegj7pbjTz93w,625,passengers 7 double trouble uber shorts,6,False
Passengers 6 Pop The Trunk #uber #shorts,J6Iw35fRLG8,2024-11-19T12:41:04Z,UCeYkB1lrXkcegj7pbjTz93w,1073,passengers 6 pop the trunk uber shorts,7,False
Passengers 5 So you freaky #shorts,u7le4gFv8mM,2024-11-19T12:26:16Z,UCeYkB1lrXkcegj7pbjTz93w,442,passengers 5 so you freaky shorts,6,False
Its Your Baby Passengers 4 #shorts,iem_SnOafMQ,2024-11-18T21:52:40Z,UCeYkB1lrXkcegj7pbjTz93w,462,its your baby passengers 4 shorts,6,False
What I want to say is passengers 3 #uber #shorts,4bkGHCkK8Qg,2024-11-18T21:40:47Z,UCeYkB1lrXkcegj7pbjTz93w,1710,what i want to say is passengers 3 uber shorts,10,False
I dont want no smoke Passengers 2 #shorts,8lQgG_t8Xrk,2024-11-18T21:32:32Z,UCeYkB1lrXkcegj7pbjTz93w,1390,i dont want no smoke passengers 2 shorts,8,False
Cant Make This Up Passengers 1 #uber #shorts,x7CKiQveWZs,2024-11-18T21:26:33Z,UCeYkB1lrXkcegj7pbjTz93w,584,cant make this up passengers 1 uber shorts,8,False
Jobs That Pay Well And Fun #pizza #shorts,bMA3p-s0Qzk,2024-11-16T15:23:02Z,UCeYkB1lrXkcegj7pbjTz93w,517,jobs that pay well and fun pizza shorts,8,False
Car Accident Doing Uber What Now,N7OsAhqPPMI,2024-11-16T14:51:51Z,UCeYkB1lrXkcegj7pbjTz93w,124,car accident doing uber what now,6,False
Salty not even the word #shorts,QPD89q4cHlo,2024-11-14T23:05:50Z,UCeYkB1lrXkcegj7pbjTz93w,570,salty not even the word shorts,6,False
Uber Driver Anxiety |My Experience and What Helps,IviLEwejqgs,2024-11-14T20:30:02Z,UCeYkB1lrXkcegj7pbjTz93w,220,uber driver anxiety my experience and what helps,8,False
Judgment day #uber #shorts,YXWy-r5o9hU,2024-11-14T04:47:17Z,UCeYkB1lrXkcegj7pbjTz93w,121,judgment day uber shorts,4,False
Use Music To Your Advantage What I Play Doing Uber and Lyft,Fed2r1LRYqc,2024-11-13T18:28:00Z,UCeYkB1lrXkcegj7pbjTz93w,119,use music to your advantage what i play doing uber and lyft,12,False
When Uber Eats Was lit #shorts,sYYe2b-zQG0,2024-11-09T18:05:10Z,UCeYkB1lrXkcegj7pbjTz93w,412,when uber eats was lit shorts,6,False
Uber Thinks Were Dumb #shorts,nkmFVf7W7mE,2024-11-09T08:13:38Z,UCeYkB1lrXkcegj7pbjTz93w,444,uber thinks were dumb shorts,5,False
How Im Making More Money DECLINING Uber Rides,2BiZbYjGKFs,2024-11-08T19:24:14Z,UCeYkB1lrXkcegj7pbjTz93w,404,how im making more money declining uber rides,8,False
Its A Game For Grownups #shorts,zPOSRanfZbA,2024-11-06T01:30:33Z,UCeYkB1lrXkcegj7pbjTz93w,446,its a game for grownups shorts,6,False
Bro Crashed Into A Telephone Pole 😳 #cops,mNnXgj2KcQs,2026-01-13T05:41:19Z,UCTmiXQVRtmKbRiq57t-4KzA,1351524,bro crashed into a telephone pole cops,7,False
Bro Was Found Curled Up In a BALL! 🤯 #cops,uQZ6OLVEeTQ,2026-01-04T04:04:03Z,UCTmiXQVRtmKbRiq57t-4KzA,18726,bro was found curled up in a ball cops,9,False
Bro Got Arrested For Weed 😳 #cops,v37D3lg9Kmc,2026-01-03T01:48:53Z,UCTmiXQVRtmKbRiq57t-4KzA,18299,bro got arrested for weed cops,6,False
Bro Got Arrested For DUI While Sober 😳 #cops,cn09ecbA56U,2025-12-23T04:11:42Z,UCTmiXQVRtmKbRiq57t-4KzA,17749394,bro got arrested for dui while sober cops,8,False
Bro Got Arrested For Filming The Cops 😳,9Cghc80Cl0g,2025-12-20T04:26:11Z,UCTmiXQVRtmKbRiq57t-4KzA,8428290,bro got arrested for filming the cops,7,False
Bro Got Arrested For Drinking Soda,B-40X05MPro,2025-12-16T23:34:00Z,UCTmiXQVRtmKbRiq57t-4KzA,65370,bro got arrested for drinking soda,6,False
Temu Samuel Jackson Got Arrested For DUI,zkvTXaSTY8c,2025-12-10T01:15:02Z,UCTmiXQVRtmKbRiq57t-4KzA,1548,temu samuel jackson got arrested for dui,7,False
Bro Got Arrested For Drinking Soda 😳 #cops,OT9zNc0gmn4,2025-12-06T03:00:11Z,UCTmiXQVRtmKbRiq57t-4KzA,44602585,bro got arrested for drinking soda cops,7,False
Bro Took On 8 Cops 😳 #DUI,I2JdC921gKE,2025-12-04T04:07:03Z,UCTmiXQVRtmKbRiq57t-4KzA,294986,bro took on 8 cops dui,6,False
Bro Thought He Was Spiderman😳#cops,JKmFDNeycaY,2025-12-02T04:06:38Z,UCTmiXQVRtmKbRiq57t-4KzA,316429,bro thought he was spiderman cops,6,False
Bro Was So Drunk He Time Traveled! 🤯,mVocMqm_4j4,2025-11-30T05:22:44Z,UCTmiXQVRtmKbRiq57t-4KzA,992609,bro was so drunk he time traveled,7,False
Escape Artist Flees From The Cops During DUI Stop,Vx-GGlm-Prc,2025-11-27T11:17:28Z,UCTmiXQVRtmKbRiq57t-4KzA,23640,escape artist flees from the cops during dui stop,9,False
Bro Was So Drunk He Heard Voices In His Head! 🤯 #cops,7Bbj4YPJ45o,2025-11-26T04:31:46Z,UCTmiXQVRtmKbRiq57t-4KzA,852919,bro was so drunk he heard voices in his head cops,11,False
Bro ACTUALLY Escaped The Cops! 🤯,j8S48kl67mM,2025-11-18T04:33:19Z,UCTmiXQVRtmKbRiq57t-4KzA,23166383,bro actually escaped the cops,5,False
Bro ALMOST Escaped The Cops In His Camaro! 🤯,p99_uJ_4YY0,2025-11-17T04:27:39Z,UCTmiXQVRtmKbRiq57t-4KzA,5408006,bro almost escaped the cops in his camaro,8,False
Bro Got Stopped For ILLEGAL 0% Tint 🤯 #cops,t300HTaPE9c,2025-11-16T03:50:30Z,UCTmiXQVRtmKbRiq57t-4KzA,132933,bro got stopped for illegal 0 tint cops,8,False
Bro Got Arrested For Running 😳 #cops,Zt8UTSpxBy0,2025-11-16T01:52:52Z,UCTmiXQVRtmKbRiq57t-4KzA,1568763,bro got arrested for running cops,6,False
Lyft Driver Karen Makes 0 IQ Mistake! 🤯 #cops,RFi0cRiQ0-M,2025-11-14T00:57:24Z,UCTmiXQVRtmKbRiq57t-4KzA,75695,lyft driver karen makes 0 iq mistake cops,8,False
Karen FREAKS OUT On Cop For No Turn Signal 😳 #cops,B_dnyL3dtEQ,2025-11-10T02:13:52Z,UCTmiXQVRtmKbRiq57t-4KzA,108391,karen freaks out on cop for no turn signal cops,10,False
Bro Was So Drunk He Couldn't See Straight 😳 #DUI #cops,m-TShPvtf_0,2025-11-09T04:59:57Z,UCTmiXQVRtmKbRiq57t-4KzA,4597305,bro was so drunk he couldn t see straight dui cops,11,False
Bro Got Obliterated From 6 Drinks & Tried To Drive Home 😳 #cops,5Ts8ocySA9Y,2025-11-06T03:31:53Z,UCTmiXQVRtmKbRiq57t-4KzA,136251,bro got obliterated from 6 drinks tried to drive home cops,11,False
Bro Outsmarts The Cops With 200 IQ,Vyld-9Q1Tqo,2025-11-04T05:20:55Z,UCTmiXQVRtmKbRiq57t-4KzA,1316067,bro outsmarts the cops with 200 iq,7,False
Cop Falls In Love During DUI Arrest 😳,jMHxzv5FPpo,2025-10-29T03:31:56Z,UCTmiXQVRtmKbRiq57t-4KzA,4924008,cop falls in love during dui arrest,7,False
Bro Tries To Act TOUGH After Car Crash 😳 #cops,xs59U5Of1tQ,2025-10-27T03:33:51Z,UCTmiXQVRtmKbRiq57t-4KzA,10451139,bro tries to act tough after car crash cops,9,False
Bro Crashes Into Police Car Because He 'Hates Cops',oGyYdOYCqT0,2025-10-22T01:06:30Z,UCTmiXQVRtmKbRiq57t-4KzA,7298,bro crashes into police car because he hates cops,9,False
Bro Took Xanax and Crashed into a Light Pole 😳 #cops,7hwQ7jl2vto,2025-10-20T03:27:24Z,UCTmiXQVRtmKbRiq57t-4KzA,4151261,bro took xanax and crashed into a light pole cops,10,False
Bro Outsmarts The Cops With 200 IQ 🤯,bxGKgNq4ZOY,2025-10-18T03:57:23Z,UCTmiXQVRtmKbRiq57t-4KzA,9082213,bro outsmarts the cops with 200 iq,7,False
Bro Got Arrested For DUI While Sober 😳,p0ehhT6Qy0k,2025-10-15T19:51:01Z,UCTmiXQVRtmKbRiq57t-4KzA,1501770,bro got arrested for dui while sober,7,False
Bro Crashes Into Cop Car Because He 'Hates Cops' 😳,f4Xwe4HCY8w,2025-10-08T23:44:21Z,UCTmiXQVRtmKbRiq57t-4KzA,9729851,bro crashes into cop car because he hates cops,9,False
Arrested For Laughing At A Cop,w_az0naLDm4,2025-10-01T03:09:58Z,UCTmiXQVRtmKbRiq57t-4KzA,39563,arrested for laughing at a cop,6,False
Female Cop Pulls Gun Instead Of Her Taser 😳,hYKWVSyb22w,2025-09-17T04:56:33Z,UCTmiXQVRtmKbRiq57t-4KzA,76894,female cop pulls gun instead of her taser,8,False
College Student Treats Cop Car Like An Uber,WrzxDjGOEro,2025-09-15T05:20:44Z,UCTmiXQVRtmKbRiq57t-4KzA,9935,college student treats cop car like an uber,8,False
Illegal Immigrant Makes Illegal U Turn Causing Fatal Car Crash 😳,2sZT1rst23M,2025-09-11T07:02:30Z,UCTmiXQVRtmKbRiq57t-4KzA,69026,illegal immigrant makes illegal u turn causing fatal car crash,10,False
Illegal Immigrant Uber Driver Attacks Uber Passenger 😳,3-FqjBWWK7w,2025-09-11T02:36:42Z,UCTmiXQVRtmKbRiq57t-4KzA,70017,illegal immigrant uber driver attacks uber passenger,7,False
Karen Attacks Uber Driver With Pepper Spray 😳,zwkw5unvCqM,2025-09-10T07:04:42Z,UCTmiXQVRtmKbRiq57t-4KzA,114921,karen attacks uber driver with pepper spray,7,False
Zombie Karen Bites Uber Driver's Neck 😳,FmY2B-A9W9I,2025-09-07T22:52:06Z,UCTmiXQVRtmKbRiq57t-4KzA,326687,zombie karen bites uber driver s neck,7,False
Meth Racoon Rats Out His Owner 😳 #cops,4lexVg8BIyw,2025-09-04T03:49:23Z,UCTmiXQVRtmKbRiq57t-4KzA,3047744,meth racoon rats out his owner cops,7,False
Bro Got Arrested For Laughing 😳 #cops,UxGLhgXYE6o,2025-09-02T05:48:44Z,UCTmiXQVRtmKbRiq57t-4KzA,21398702,bro got arrested for laughing cops,6,False
Road Rager Fights Motorcyclist with Helmet⛑️😳,n5WB6bJqQdI,2025-08-30T03:21:36Z,UCTmiXQVRtmKbRiq57t-4KzA,66910,road rager fights motorcyclist with helmet,6,False
Bro Lost Control Going 50 MPH and Crashed 😳,POvXAFXi3lA,2025-08-29T04:53:37Z,UCTmiXQVRtmKbRiq57t-4KzA,330512,bro lost control going 50 mph and crashed,8,False
Girl Gets EJECTED From 88 MPH Car Crash 😳,V3rDieiooFQ,2025-08-29T01:22:43Z,UCTmiXQVRtmKbRiq57t-4KzA,155534,girl gets ejected from 88 mph car crash,8,False
Dummies Get Wrecked with NO SEAT BELT at 25 MPH! 😳,VyY5oLgsTes,2025-08-28T01:08:31Z,UCTmiXQVRtmKbRiq57t-4KzA,48315,dummies get wrecked with no seat belt at 25 mph,10,False
Bro Gets Ejected From Car While Rolling Down a Hill 😳,CSNDiZItLzM,2025-08-26T23:00:27Z,UCTmiXQVRtmKbRiq57t-4KzA,74238,bro gets ejected from car while rolling down a hill,10,False
This is Why You Carry While Driving 😳,F9gOZeXmXww,2025-08-23T16:53:38Z,UCTmiXQVRtmKbRiq57t-4KzA,103121,this is why you carry while driving,7,False
College kid MISTAKES cop car for Uber 😳,3l0UccuArE8,2025-08-15T02:00:03Z,UCTmiXQVRtmKbRiq57t-4KzA,12710153,college kid mistakes cop car for uber,7,False
Cop Does 109 MPH PIT Maneuver and Goes Airborne 😳,Qb2K-ma050g,2025-08-13T04:09:02Z,UCTmiXQVRtmKbRiq57t-4KzA,374979,cop does 109 mph pit maneuver and goes airborne,9,False
Vantrue N4 Pro Review: The Ultimate 3-Channel Dash Cam in 2025!,0k45u8Ksf6U,2025-08-11T15:56:34Z,UCTmiXQVRtmKbRiq57t-4KzA,3148,vantrue n4 pro review the ultimate 3 channel dash cam in 2025,12,False
Did This Car Just Vanish From The Cops?🤯,g3vdym_pmQM,2025-08-10T04:00:15Z,UCTmiXQVRtmKbRiq57t-4KzA,5139009,did this car just vanish from the cops,8,False
Car Salesman Gets Busted Going 103 MPH During Test Drive😳#cops,xcAq8ybguFE,2025-08-09T16:39:09Z,UCTmiXQVRtmKbRiq57t-4KzA,515830,car salesman gets busted going 103 mph during test drive cops,11,False
The Luckiest Cop Alive Survives Shocking Crash,2RlJU0hoCf8,2025-08-05T17:13:38Z,UCTmiXQVRtmKbRiq57t-4KzA,43011,the luckiest cop alive survives shocking crash,7,False
The Luckiest Cop on Earth 😳,-RXxbox-iOg,2025-08-02T02:45:04Z,UCTmiXQVRtmKbRiq57t-4KzA,28601415,the luckiest cop on earth,5,False
