text_videotitle,video_id,published_at,channel_id,video_viewcount,title_clean,title_wordcount,is_date_like
LYFT CANT FIX WHATS IRREPARABLE BEEN BROKEN TO LONG !!!,jBqhBk0Knw4,2024-02-12T18:55:51Z,UCVzVI6PJ1IxiNBe9qwqiDhQ,105,lyft cant fix whats irreparable been broken to long,9,False
ARE YOU FOR THE PROTEST OR ARE YOU USING THE PROTEST FOR PERSONAL SHINE ?!,UfwduiJbQaY,2024-02-07T18:11:33Z,UCVzVI6PJ1IxiNBe9qwqiDhQ,69,are you for the protest or are you using the protest for personal shine,14,False
UNHAPPY LYFT & UBER DRIVERS ARE THEY ALL JUST COMPLAINER’S ?,p8KPdPZ580Y,2024-02-06T18:50:51Z,UCVzVI6PJ1IxiNBe9qwqiDhQ,360,unhappy lyft uber drivers are they all just complainer s,10,False
GOOD OLE CONVERSATION MONDAY EVERYBODY HAS AN OPINION !!!,Y-uKFP1gfm8,2024-02-05T18:46:15Z,UCVzVI6PJ1IxiNBe9qwqiDhQ,53,good ole conversation monday everybody has an opinion,8,False
EXPOSED !!! RONNIEPETV DOESNT SUPPORT LYFT & UBER DRIVERS !!!,BFve6TBt7CI,2024-02-03T00:34:16Z,UCVzVI6PJ1IxiNBe9qwqiDhQ,252,exposed ronniepetv doesnt support lyft uber drivers,7,False
EXPOSED!! THE RIDESHARE GUY DOESNT SUPPORT LYFT & UBER DRIVERS !!!,ba086rHkw6U,2024-02-02T18:46:27Z,UCVzVI6PJ1IxiNBe9qwqiDhQ,506,exposed the rideshare guy doesnt support lyft uber drivers,9,False
🤷🏼‍♂️FANI WILLIS WITH RESTING I F’D UP FACE BUT WHY ??,C6vkwyyk6ec,2024-02-01T19:00:10Z,UCVzVI6PJ1IxiNBe9qwqiDhQ,51,fani willis with resting i f d up face but why,11,False
NEW & FUTURE LYFT DRIVERS A CAR WASH SUBSCRIPTION IS MOST IMPORTANT!!!,Nd4SUOGRWbk,2024-01-31T22:14:14Z,UCVzVI6PJ1IxiNBe9qwqiDhQ,104,new future lyft drivers a car wash subscription is most important,11,False
😤NEW & FUTURE LYFT DRIVERS AVOID ROAD RAGE !,9IUu6NFi8uE,2024-01-31T18:45:12Z,UCVzVI6PJ1IxiNBe9qwqiDhQ,73,new future lyft drivers avoid road rage,7,False
ANY TYPE OF INTERIOR CAR DAMAGE CAUSED BY THE RIDER TAKE PICTURES FIRST !!!,aEukXMsfBIo,2024-01-31T03:04:42Z,UCVzVI6PJ1IxiNBe9qwqiDhQ,56,any type of interior car damage caused by the rider take pictures first,13,False
NEW & FUTURE LYFT EXPRESS PROGRAM DRIVERS DONT JUST TAKE ANY CAR !!!,yNB27D8Yq9E,2024-01-30T21:49:15Z,UCVzVI6PJ1IxiNBe9qwqiDhQ,122,new future lyft express program drivers dont just take any car,11,False
NEW & FUTURE LYFT DRIVERS TOLL’S CAN BE TRICKY !!!,6umKETeIl0I,2024-01-30T18:28:05Z,UCVzVI6PJ1IxiNBe9qwqiDhQ,76,new future lyft drivers toll s can be tricky,9,False
NEW & FUTURE LYFT DRIVERS NO PHONE CALLS OR FACETIME DURING A RIDE!!!,epOL5lKu4RA,2024-01-30T00:38:24Z,UCVzVI6PJ1IxiNBe9qwqiDhQ,91,new future lyft drivers no phone calls or facetime during a ride,12,False
LYFT DRIVERS KEEP YOUR HEAD ON THE SWIVEL!!,OZWoeSu37R0,2024-01-29T21:23:40Z,UCVzVI6PJ1IxiNBe9qwqiDhQ,110,lyft drivers keep your head on the swivel,8,False
LYFT IS ROBBING THE DRIVERS BLIND BY STEALING A PERCENTAGE OF THERE TIPS !!!,3mv8lsev2-g,2024-01-29T17:28:07Z,UCVzVI6PJ1IxiNBe9qwqiDhQ,187,lyft is robbing the drivers blind by stealing a percentage of there tips,13,False
WHY BLACK PEOPLE NOT SUPPORTING FANI WILLIS & NATHAN WADE HERES WHY !,ho2rabsv9VU,2024-01-27T16:47:08Z,UCVzVI6PJ1IxiNBe9qwqiDhQ,73,why black people not supporting fani willis nathan wade heres why,11,False
NEW & FUTURE LYFT DRIVERS NO BAGS LEFT BEHIND DONT ALLOW IT !!!!,057g2upjiaI,2024-01-26T18:28:45Z,UCVzVI6PJ1IxiNBe9qwqiDhQ,203,new future lyft drivers no bags left behind dont allow it,11,False
WILL LYFT & UBER RIDERS SUPPORT THE PROTEST AND APP SHIT DOWN WITH THE DRIVERS???,y9WofaTElok,2024-01-25T01:39:20Z,UCVzVI6PJ1IxiNBe9qwqiDhQ,211,will lyft uber riders support the protest and app shit down with the drivers,14,False
TRUMP WON NEW HAMPSHIRE OH BOY!!!,mOBRyblSwMY,2024-01-24T21:29:32Z,UCVzVI6PJ1IxiNBe9qwqiDhQ,77,trump won new hampshire oh boy,6,False
WHY DO LYFT & UBER DRIVERS COMPLAIN SO MUCH BUT STLL DRIVE ?!,XzRl1OkaWuQ,2024-01-24T18:23:33Z,UCVzVI6PJ1IxiNBe9qwqiDhQ,83,why do lyft uber drivers complain so much but stll drive,11,False
😐IF TD JAKES IS GAY THATS HIS BUSINESS AND HIS AZZ !!!,KLgoYeBUfZQ,2024-01-24T00:35:02Z,UCVzVI6PJ1IxiNBe9qwqiDhQ,40,if td jakes is gay thats his business and his azz,11,False
NEW & FUTURE LYFT DRIVERS DONT BE APART OF A DRUG DEAL !,0lfIkqZILt0,2024-01-23T21:05:46Z,UCVzVI6PJ1IxiNBe9qwqiDhQ,295,new future lyft drivers dont be apart of a drug deal,11,False
IS THERE A SECRET TO MAKE $300 A DAY AS A LYFT DRIVER?,DRMunYwGxJk,2024-01-23T19:16:18Z,UCVzVI6PJ1IxiNBe9qwqiDhQ,176,is there a secret to make 300 a day as a lyft driver,13,False
FANI WILLIS A PRIME EXAMPLE OF A POWER ABUSER MY PERDICTION !,N-CMJz_9ICY,2024-01-23T02:18:57Z,UCVzVI6PJ1IxiNBe9qwqiDhQ,98,fani willis a prime example of a power abuser my perdiction,11,False
CALLING ALL LYFT & UBER DRIVERS PLEASE JOIN THE STRIKE & APP SHUT DOWN 2/14/2024,tsJirL7708M,2024-01-22T21:18:57Z,UCVzVI6PJ1IxiNBe9qwqiDhQ,403,calling all lyft uber drivers please join the strike app shut down 2 14 2024,15,False
CAN I CARRY MY CONSEALED LICENSED WEAPON AS A LYFT DRIVER??!,DPEg0E0_qe8,2024-01-22T18:25:55Z,UCVzVI6PJ1IxiNBe9qwqiDhQ,83,can i carry my consealed licensed weapon as a lyft driver,11,False
LGBTQ THIS BULLSH*T DONT BELONGS IN PUBLIC SCHOOL SYSTEMS !!!,SD5-5TkwoBU,2024-01-21T03:53:28Z,UCVzVI6PJ1IxiNBe9qwqiDhQ,72,lgbtq this bullsh t dont belongs in public school systems,10,False
NEW & FUTURE LYFT DRIVERS HERES THE TRUTH !!!,ymSqMdgRfUU,2024-01-20T02:00:54Z,UCVzVI6PJ1IxiNBe9qwqiDhQ,239,new future lyft drivers heres the truth,7,False
TASHA K THIS WINCH GOING TO JAIL!!!,yhwPd6N671g,2024-01-19T23:34:44Z,UCVzVI6PJ1IxiNBe9qwqiDhQ,181,tasha k this winch going to jail,7,False
😒YOU ARE A LYFT DRIVER NOT A MOVING COMPANY !!!!,wRdKdk-EGdo,2024-01-19T18:25:06Z,UCVzVI6PJ1IxiNBe9qwqiDhQ,238,you are a lyft driver not a moving company,9,False
STAY AWAY FROM HOSPITAL TRIPS NOTHING BUT TROUBLE!!!!,-VQBv04Vb20,2024-01-19T01:42:08Z,UCVzVI6PJ1IxiNBe9qwqiDhQ,784,stay away from hospital trips nothing but trouble,8,False
A MESSAGE DIRECTLY TO THE DRIVERS!!!,fjmbGhe9Ois,2024-01-18T21:59:55Z,UCVzVI6PJ1IxiNBe9qwqiDhQ,122,a message directly to the drivers,6,False
🤦🏻ARE YOU STUCK IN THE LYFT EXPRESS DRIVE PROGRAM !!?,cdGXALw9acg,2024-01-18T19:10:16Z,UCVzVI6PJ1IxiNBe9qwqiDhQ,203,are you stuck in the lyft express drive program,9,False
NEW & FUTURE LYFT DRIVERS KEEPING A CLEAN CAR IS VERY IMPORTANT!!!,JZKksHsY7_Y,2024-01-18T00:57:18Z,UCVzVI6PJ1IxiNBe9qwqiDhQ,94,new future lyft drivers keeping a clean car is very important,11,False
NEW & FUTURE LYFT DRIVERS UNDERSTAND THE WEAR & TEAR YOUR CAR WILL GO THRU,cCLYETSzZQo,2024-01-17T21:01:41Z,UCVzVI6PJ1IxiNBe9qwqiDhQ,179,new future lyft drivers understand the wear tear your car will go thru,13,False
🤔YOUTUBE RIDESHARE CHANNELS MAKING MONEY VS NOT MAKING MONEY !!!,EpKCC5ZClJs,2024-01-17T19:13:21Z,UCVzVI6PJ1IxiNBe9qwqiDhQ,69,youtube rideshare channels making money vs not making money,9,False
DO NOT CHASE BONUSES CREATE A PER HOUR $ STRATEGY!!!,eTAfiYmc3vs,2024-01-17T02:22:41Z,UCVzVI6PJ1IxiNBe9qwqiDhQ,160,do not chase bonuses create a per hour strategy,9,False
⏰LYFT EXPRESS PROGRAM DRIVERS THE CLOCK IS TICKING !!!!,ydZzmheCzAM,2024-01-17T00:03:04Z,UCVzVI6PJ1IxiNBe9qwqiDhQ,153,lyft express program drivers the clock is ticking,8,False
NEW & FUTURE LYFT DRIVERS YOU WILL NEED TO MAKE ADJUSTMENTS!!!,dWomfc7Dq9w,2024-01-16T18:51:06Z,UCVzVI6PJ1IxiNBe9qwqiDhQ,227,new future lyft drivers you will need to make adjustments,10,False
BIG JOOK THEM STEPPA’S BAKED HIM A CAKE !!!,hXrHu4rgTck,2024-01-15T20:53:02Z,UCVzVI6PJ1IxiNBe9qwqiDhQ,3310,big jook them steppa s baked him a cake,9,False
NEW & FUTURE LYFT EXPRESS PROGRAM DRIVERS 3 THINGS YOU WILL NEED !!!,DINT2eo8p9s,2024-01-15T19:27:58Z,UCVzVI6PJ1IxiNBe9qwqiDhQ,225,new future lyft express program drivers 3 things you will need,11,False
HOW TO DEAL WITH THE ELDERLY & DISABLED AS A LYFT DRIVER!!!,R41ZJazL4Sg,2024-01-11T17:41:04Z,UCVzVI6PJ1IxiNBe9qwqiDhQ,65,how to deal with the elderly disabled as a lyft driver,11,False
NEW & FUTURE LYFT DRIVERS RULE # 1 NO CHILD CAR SEAT NO RIDE !!! ( PART 2 ),-4CY8o9Y1lM,2024-01-11T16:38:47Z,UCVzVI6PJ1IxiNBe9qwqiDhQ,115,new future lyft drivers rule 1 no child car seat no ride part 2,14,False
🤣KATT WILLIAMS AINT CRAZY HE JUST REAL !!!,uv3Pf4cFR7s,2024-01-08T21:13:57Z,UCVzVI6PJ1IxiNBe9qwqiDhQ,454,katt williams aint crazy he just real,7,False
NEW & FUTURE LYFT DRIVERS NO CHILD CAR SEAT NO RIDE !!! ( PART 1 ),uzEF96bwFHI,2024-01-08T18:52:42Z,UCVzVI6PJ1IxiNBe9qwqiDhQ,120,new future lyft drivers no child car seat no ride part 1,12,False
These bonuses are Lyft’s algorithms tricks to keep the drivers off balance!!!,Ordzy-XcBUE,2024-01-04T17:01:43Z,UCVzVI6PJ1IxiNBe9qwqiDhQ,380,these bonuses are lyft s algorithms tricks to keep the drivers off balance,13,False
REACH OUT AND TOUCH SOMEBODY’S HAND MAKE THIS WORLD A BETTER PLACE IF YOU CAN !!!,KFsUHQkAIOU,2024-01-03T20:42:42Z,UCVzVI6PJ1IxiNBe9qwqiDhQ,52,reach out and touch somebody s hand make this world a better place if you can,16,False
⚠️NEW & FUTURE LYFT DRIVERS ALL INFORMATION IS NOT GOOD INFO BE CAREFUL!!!,L23P1u4Tvss,2024-01-02T18:45:09Z,UCVzVI6PJ1IxiNBe9qwqiDhQ,264,new future lyft drivers all information is not good info be careful,12,False
🎈2024 happy New Years we are drivers not door mats !!!,11UGnMPEcMM,2024-01-02T18:04:21Z,UCVzVI6PJ1IxiNBe9qwqiDhQ,84,2024 happy new years we are drivers not door mats,10,False
🤔SO YOU WANT TO JOIN THE LYFT EXPRESS DRIVE PROGRAM IN 2024 ?,A95ECODW_Bo,2023-12-21T17:40:24Z,UCVzVI6PJ1IxiNBe9qwqiDhQ,550,so you want to join the lyft express drive program in 2024,12,False
HONEYKOMB BRAZY GOT PLAYED FROM THE TOP !!!!,wwzAr1ZME6M,2023-12-20T20:15:09Z,UCVzVI6PJ1IxiNBe9qwqiDhQ,139,honeykomb brazy got played from the top,7,False
LYFT XL IS BULLSH*T !!!,bpOF6Iy7wgc,2023-12-19T17:45:10Z,UCVzVI6PJ1IxiNBe9qwqiDhQ,320,lyft xl is bullsh t,5,False
WHY IS THE PERCENTAGE OF $TIPS SO LOW FOR LYFT DRIVERS?!!!,ye6YXpQwq_I,2023-12-18T19:59:40Z,UCVzVI6PJ1IxiNBe9qwqiDhQ,218,why is the percentage of tips so low for lyft drivers,11,False
ZERO TOLERANCE POLICY FOR LYFT RIDERS & THERE BULLSH*T !!!,LyKOH97Qh-I,2023-12-14T17:16:06Z,UCVzVI6PJ1IxiNBe9qwqiDhQ,562,zero tolerance policy for lyft riders there bullsh t,9,False
90% OF LYFT DRIVERS DEACTIVATIONS ARE FROM FALSE CLAIMS !!!!,QXxwkOt0EZI,2023-12-11T17:19:48Z,UCVzVI6PJ1IxiNBe9qwqiDhQ,810,90 of lyft drivers deactivations are from false claims,9,False
LYFT ASSISTED RIDES IS A NO NO DONT GET CAUGHT UP !!! ( ITS A TRAP ),YYbBQ7FksS4,2023-12-07T20:08:44Z,UCVzVI6PJ1IxiNBe9qwqiDhQ,259,lyft assisted rides is a no no dont get caught up its a trap,14,False
NEW & FUTURE LYFT DRIVERS LONG TRIPS DONT BENEFIT NOBODY BUT LYFT !!!,4CV-ZOg-Hao,2023-12-06T23:22:30Z,UCVzVI6PJ1IxiNBe9qwqiDhQ,242,new future lyft drivers long trips dont benefit nobody but lyft,11,False
How to Shut Down Uber Riders who get in and say “I’m in a Hurry!,s-kJ_3qOUIw,2025-06-08T21:23:07Z,UCaZiGrGjZhyYZmBTN5r11iw,1574,how to shut down uber riders who get in and say i m in a hurry,16,False
Dumb & Dumberest Uber Ride to Airport,TjzF-178xFI,2025-06-05T21:03:36Z,UCaZiGrGjZhyYZmBTN5r11iw,1396,dumb dumberest uber ride to airport,6,False
Uber App Updates… NEVER in Driver’s Favor #ridesharedriver #uberdriver #lasvegas,TsPMOp3ckwQ,2022-07-22T15:37:47Z,UCaZiGrGjZhyYZmBTN5r11iw,569,uber app updates never in driver s favor ridesharedriver uberdriver lasvegas,11,False
Shared Rides are Back! #ridesharedriver #uberdriver #lyftdriver,gYMT0FxKGEs,2022-07-19T10:47:09Z,UCaZiGrGjZhyYZmBTN5r11iw,206,shared rides are back ridesharedriver uberdriver lyftdriver,7,False
The Simplest Zero Effort Way to Increase Tips in Rideshare!,ErmNCOoP_w0,2022-07-13T02:02:59Z,UCaZiGrGjZhyYZmBTN5r11iw,1674,the simplest zero effort way to increase tips in rideshare,10,False
"Closed (Driver) Mouths, Don’t Get (Tip) Fed! #lyftdriver #ridesharedriver #uberdriver",MOyTZxNpcT4,2022-07-07T18:08:17Z,UCaZiGrGjZhyYZmBTN5r11iw,238,closed driver mouths don t get tip fed lyftdriver ridesharedriver uberdriver,11,False
How to get Max MGM Grand Surge Attached,FhpFQ5eqw6o,2022-06-26T23:31:22Z,UCaZiGrGjZhyYZmBTN5r11iw,219,how to get max mgm grand surge attached,8,False
Bellagio & Palazzo - Newest Rideshare “Rules”,jB7OuhAmt-8,2022-06-11T18:31:20Z,UCaZiGrGjZhyYZmBTN5r11iw,252,bellagio palazzo newest rideshare rules,5,False
F*cking With Riders - The Bellagio Fountains,P0TVHMh5-fI,2022-06-07T05:01:49Z,UCaZiGrGjZhyYZmBTN5r11iw,191,f cking with riders the bellagio fountains,7,False
How to Keep Your Ride Spic & Span Without a Vacuum!,TBZwJwsuOd0,2022-06-06T19:56:38Z,UCaZiGrGjZhyYZmBTN5r11iw,230,how to keep your ride spic span without a vacuum,10,False
"Hey Bro, You Want Me To Call You An Uber?!",KbqHYswcjRw,2022-05-22T08:16:23Z,UCaZiGrGjZhyYZmBTN5r11iw,984,hey bro you want me to call you an uber,10,False
"Dejon! Put Some Mustard on it, or you Gonna Be Playing Ketchup!",T5OJyKKlf9o,2022-05-20T01:59:14Z,UCaZiGrGjZhyYZmBTN5r11iw,1487,dejon put some mustard on it or you gonna be playing ketchup,12,False
"Yo Bro, It’s Uber Pet, Not Uber Zoo!",braaMYmyf6s,2022-05-20T01:57:36Z,UCaZiGrGjZhyYZmBTN5r11iw,9634,yo bro it s uber pet not uber zoo,9,False
"EDC Vegas, 4-pax is Back & the New “Shared” Rides - Part Two",jKIfsU3AIQA,2022-05-19T13:55:40Z,UCaZiGrGjZhyYZmBTN5r11iw,190,edc vegas 4 pax is back the new shared rides part two,12,False
"EDC Vegas, 4-pax is Back & the “New Shared” Rides - Part One",galIy7GL9cA,2022-05-18T19:42:27Z,UCaZiGrGjZhyYZmBTN5r11iw,219,edc vegas 4 pax is back the new shared rides part one,12,False
The “Pink” Plunges Deeper Into The Red,LubHUaOyn3g,2022-05-05T18:22:02Z,UCaZiGrGjZhyYZmBTN5r11iw,204,the pink plunges deeper into the red,7,False
What Is Uber “Boost” All About?,SBtI17fnQK8,2022-05-02T19:09:32Z,UCaZiGrGjZhyYZmBTN5r11iw,1852,what is uber boost all about,6,False
“You Want Your Tip In The App Or In Cash?” - Here’s How You Answer!,t81PKMOJcOI,2022-04-18T03:58:16Z,UCaZiGrGjZhyYZmBTN5r11iw,230,you want your tip in the app or in cash here s how you answer,15,False
Oh Sh*t! I’m Driving On The Wrong Side Of The Road!,PHCnnlhvQDo,2022-03-23T02:42:07Z,UCaZiGrGjZhyYZmBTN5r11iw,157,oh sh t i m driving on the wrong side of the road,13,False
Having Fun With Pax With The So-Called “Fuel Surcharge”,8PWoW72TyhA,2022-03-15T18:03:45Z,UCaZiGrGjZhyYZmBTN5r11iw,212,having fun with pax with the so called fuel surcharge,10,False
"Gas, Grass or @ss, Uber’s Fuel Surcharge Ain’t Free!",0zSwP2UQFDg,2022-03-12T22:38:19Z,UCaZiGrGjZhyYZmBTN5r11iw,233,gas grass or ss uber s fuel surcharge ain t free,11,False
What Are Lyft “Power Zones”? Are They Legit?,7J_yfXlipvI,2022-03-05T03:03:33Z,UCaZiGrGjZhyYZmBTN5r11iw,249,what are lyft power zones are they legit,8,False
"Be Thankful, Not Hostile",nGqWbjWFEJk,2022-03-01T02:32:12Z,UCaZiGrGjZhyYZmBTN5r11iw,148,be thankful not hostile,4,False
Rock No’ Roll Marathon And Harry Reid Fun!,5EJ1xWU2Ifs,2022-02-27T23:58:08Z,UCaZiGrGjZhyYZmBTN5r11iw,126,rock no roll marathon and harry reid fun,8,False
We Have Such A Unique Opportunity To Impact Strangers - I’m Literally In Tears,_4x5Y3YgNbw,2022-02-22T17:17:10Z,UCaZiGrGjZhyYZmBTN5r11iw,164,we have such a unique opportunity to impact strangers i m literally in tears,14,False
Why Is The Airport Queue Not Showing On My Uber App!?,w0zVyJoijyo,2022-02-17T20:36:13Z,UCaZiGrGjZhyYZmBTN5r11iw,1591,why is the airport queue not showing on my uber app,11,False
Mask Confusion Coming Back To Vegas,m9F1bEwX6Og,2022-02-12T22:44:06Z,UCaZiGrGjZhyYZmBTN5r11iw,120,mask confusion coming back to vegas,6,False
"Don’t Cancel! Hunt Your Pax Down, Especially When It’s Slow",GSV6ZvYuFaQ,2022-02-10T22:03:06Z,UCaZiGrGjZhyYZmBTN5r11iw,209,don t cancel hunt your pax down especially when it s slow,12,False
Do Uber/Lyft Driver Ratings Really Matter?,dD0ow0ij6uw,2022-02-03T02:23:50Z,UCaZiGrGjZhyYZmBTN5r11iw,307,do uber lyft driver ratings really matter,7,False
How To Turn Off Your Seatbelt Reminder On Under#uberdriver #ridesharedriver #,QXbk66bs7Gg,2022-02-03T01:58:29Z,UCaZiGrGjZhyYZmBTN5r11iw,1857,how to turn off your seatbelt reminder on underuberdriver ridesharedriver,10,False
Where The Heck Did My Rider Comments Go On Uber?,T-_SMMLEM6k,2022-01-28T00:00:13Z,UCaZiGrGjZhyYZmBTN5r11iw,139,where the heck did my rider comments go on uber,10,False
Keep Your Chin Up & Your Opportunities Open!,U-MX5dpJcGU,2022-01-18T00:35:43Z,UCaZiGrGjZhyYZmBTN5r11iw,248,keep your chin up your opportunities open,7,False
Try This Out When Greeting Pax!,PaIvVgMGQI8,2022-01-12T04:00:36Z,UCaZiGrGjZhyYZmBTN5r11iw,259,try this out when greeting pax,6,False
You Now Need A Tape Measure To Do Rideshare In Vegas!,2i-JxGhiNsk,2022-01-05T22:14:55Z,UCaZiGrGjZhyYZmBTN5r11iw,562,you now need a tape measure to do rideshare in vegas,11,False
Happy New Year From The KICKBACK Team! And A Quick Update On CES Pickups/Drops,Lpqi3uiPFQE,2022-01-03T20:05:50Z,UCaZiGrGjZhyYZmBTN5r11iw,250,happy new year from the kickback team and a quick update on ces pickups drops,15,False
Make An Easy Extra $50 During CES With RIDEPLAY tv!,OlX9Azn5fwU,2021-12-30T02:53:42Z,UCaZiGrGjZhyYZmBTN5r11iw,241,make an easy extra 50 during ces with rideplay tv,10,False
What You Should Do When You’re Applying Your New Registration Sticker,kli2j8Crltw,2021-12-29T02:03:11Z,UCaZiGrGjZhyYZmBTN5r11iw,10005,what you should do when you re applying your new registration sticker,12,False
Some Pro-Tips For Doing Vegas Rideshare Over The Holidays,Xdu1bpbPWtA,2021-12-25T00:49:32Z,UCaZiGrGjZhyYZmBTN5r11iw,158,some pro tips for doing vegas rideshare over the holidays,10,False
Uber & Lyft Drivers Are Getting A “Raise” In 2022,4nRJFg44BKs,2021-12-23T20:43:12Z,UCaZiGrGjZhyYZmBTN5r11iw,1266,uber lyft drivers are getting a raise in 2022,9,False
Where Have All The Cowboys Gone?,JEY2ML5s_3Q,2021-12-15T21:24:57Z,UCaZiGrGjZhyYZmBTN5r11iw,175,where have all the cowboys gone,6,False
How To Turn Off Ride Requests & Edit Destination In Lyft Update 12/02/21,u3gMAcOm4qA,2021-12-03T05:45:05Z,UCaZiGrGjZhyYZmBTN5r11iw,8461,how to turn off ride requests edit destination in lyft update 12 02 21,14,False
Yee-Haw! How To Tie Down Tips & Kickers With The Rodeo Folk!,vKVxolf2V7M,2021-12-02T23:38:22Z,UCaZiGrGjZhyYZmBTN5r11iw,181,yee haw how to tie down tips kickers with the rodeo folk,12,False
New Rideshare Pickup Area At Flamingo - Effective 11/26/21,Ubq3UixRUh0,2021-11-28T06:27:51Z,UCaZiGrGjZhyYZmBTN5r11iw,226,new rideshare pickup area at flamingo effective 11 26 21,10,False
Should I Rent Or Buy A Vehicle For Rideshare?,_oHrFNJKIaI,2021-11-23T03:09:05Z,UCaZiGrGjZhyYZmBTN5r11iw,292,should i rent or buy a vehicle for rideshare,9,False
How To Turn Your Maps & Audio On In Both Uber & Lyft,qZJC1eTA_GU,2021-11-19T01:00:44Z,UCaZiGrGjZhyYZmBTN5r11iw,19319,how to turn your maps audio on in both uber lyft,11,False
How Does Long Pickup Pay Work On Uber?,dDeLrjWUDxY,2021-11-17T03:25:30Z,UCaZiGrGjZhyYZmBTN5r11iw,1047,how does long pickup pay work on uber,8,False
How To Turn On Ride Types & Deal With Current Glitch In The Uber App - 11/11/2021,YDC9koG_ztw,2021-11-11T23:55:21Z,UCaZiGrGjZhyYZmBTN5r11iw,492,how to turn on ride types deal with current glitch in the uber app 11 11 2021,17,False
A FREE APP For Delivery Drivers (And Rideshare Drivers Working Gated Communities),G02dku6eXVk,2021-11-11T07:52:43Z,UCaZiGrGjZhyYZmBTN5r11iw,187,a free app for delivery drivers and rideshare drivers working gated communities,12,False
"A Big Week For Vegas Drivers As We Welcome SEMA, Auto Aftermarket & Women’s Rodeo!",2jefhPT_KQ0,2021-11-02T21:54:46Z,UCaZiGrGjZhyYZmBTN5r11iw,175,a big week for vegas drivers as we welcome sema auto aftermarket women s rodeo,15,False
What Are Lyft’s Power Zones? And Something Smells Phishy In Vegas!,IfG8baaFGcw,2021-10-28T00:11:08Z,UCaZiGrGjZhyYZmBTN5r11iw,196,what are lyft s power zones and something smells phishy in vegas,12,False
Musk’s Boring Company Gains Approval For Resort Corridor Tunnel System - What’s This Mean For….,1w7porBAOcE,2021-10-25T22:39:35Z,UCaZiGrGjZhyYZmBTN5r11iw,137,musk s boring company gains approval for resort corridor tunnel system what s this mean for,16,False
And The Color Of Your New Clark County Business License Is…,q92vPaUKXdo,2021-10-23T18:45:10Z,UCaZiGrGjZhyYZmBTN5r11iw,360,and the color of your new clark county business license is,11,False
How To Do EDC Vegas!,0kyRua5o0K8,2021-10-20T22:43:13Z,UCaZiGrGjZhyYZmBTN5r11iw,169,how to do edc vegas,5,False
How To Use Vegas Kickback App & Your Uber Profile To Make More $$$,lktvD0RgHb0,2021-10-06T23:02:03Z,UCaZiGrGjZhyYZmBTN5r11iw,1014,how to use vegas kickback app your uber profile to make more,12,False
Uber Now Attaching Surge To Scheduled Rides!,qPBXMZM2J6E,2021-10-05T20:14:53Z,UCaZiGrGjZhyYZmBTN5r11iw,451,uber now attaching surge to scheduled rides,7,False
"Rich, Why Are My Consective Ride Bonuses Not Showing Up?",OOkV5pZ4CpE,2021-10-02T02:35:28Z,UCaZiGrGjZhyYZmBTN5r11iw,297,rich why are my consective ride bonuses not showing up,10,False
Do I Need Business Licenses To Do Rideshare In Las Vegas? #uberdriver #lyftdriver #vegasrideshare,1rQRAwyjkHU,2021-10-02T02:30:38Z,UCaZiGrGjZhyYZmBTN5r11iw,1817,do i need business licenses to do rideshare in las vegas uberdriver lyftdriver vegasrideshare,14,False
Uber’s Payout Processing Issues - Don’t Get Your Panties In A Bunch!,wQyvO44gMxE,2021-09-28T06:17:14Z,UCaZiGrGjZhyYZmBTN5r11iw,4599,uber s payout processing issues don t get your panties in a bunch,13,False
Ain’t No $30 3-Ride Streak Gonna Get Drivers Out Of Bed Uber!,T78jRwVNdUI,2021-09-27T17:00:51Z,UCaZiGrGjZhyYZmBTN5r11iw,405,ain t no 30 3 ride streak gonna get drivers out of bed uber,14,False
Do I Need To Upload Health Insurance To Drive For Lyft?,RdcSo8lGEGo,2021-09-22T22:17:16Z,UCaZiGrGjZhyYZmBTN5r11iw,3714,do i need to upload health insurance to drive for lyft,11,False
Some Great News For Vegas Drivers!,j0bdGfgmKZM,2021-09-22T22:11:21Z,UCaZiGrGjZhyYZmBTN5r11iw,1899,some great news for vegas drivers,6,False
How To Do Life Is Beautiful - 2021,ukvoNM_xdLw,2021-09-16T22:35:49Z,UCaZiGrGjZhyYZmBTN5r11iw,305,how to do life is beautiful 2021,7,False
Having Fun With Football Fans!,99xNNjqExVY,2021-09-16T17:59:44Z,UCaZiGrGjZhyYZmBTN5r11iw,47,having fun with football fans,5,False
Two Pro-tips For ALL Rides To Allegiant Stadium Events,ZIeyHEQ01K8,2021-09-13T16:42:19Z,UCaZiGrGjZhyYZmBTN5r11iw,2459,two pro tips for all rides to allegiant stadium events,10,False
How To Talk To Convention Pax!,KOzHzipaaZc,2021-09-09T18:26:31Z,UCaZiGrGjZhyYZmBTN5r11iw,190,how to talk to convention pax,6,False
How To Stop Ride Requests In The Uber Driver App,5ne3Ft_Lkh4,2021-09-09T17:50:15Z,UCaZiGrGjZhyYZmBTN5r11iw,26051,how to stop ride requests in the uber driver app,10,False
A Tale Of 2 Drivers’ Earnings - Don’t Crush Your Soul For Uber & Lyft,PN4mdPpPVg4,2021-09-08T14:47:09Z,UCaZiGrGjZhyYZmBTN5r11iw,494,a tale of 2 drivers earnings don t crush your soul for uber lyft,14,False
Holy Sh*t! Did You Clean Out Your Safe!?!,CUwmpSdlufk,2021-09-05T17:28:00Z,UCaZiGrGjZhyYZmBTN5r11iw,173,holy sh t did you clean out your safe,9,False
How To Set Up Lyft Arrive-By Destination Filter,2iOPm2nem8E,2021-09-05T17:05:56Z,UCaZiGrGjZhyYZmBTN5r11iw,8429,how to set up lyft arrive by destination filter,9,False
Uber - How To Update Pax Destination & Other “New” Features,BMXHk7IDePU,2021-08-28T23:38:37Z,UCaZiGrGjZhyYZmBTN5r11iw,430,uber how to update pax destination other new features,9,False
Uber’s New “Wait-Time Surge” - A Nice Bone For Drivers!,d0064YG5gOQ,2021-08-26T20:44:14Z,UCaZiGrGjZhyYZmBTN5r11iw,383,uber s new wait time surge a nice bone for drivers,11,False
How To Set Up Lyft Arrive-By Destination Filter,AjHwo34Uw_A,2021-08-26T17:45:26Z,UCaZiGrGjZhyYZmBTN5r11iw,300,how to set up lyft arrive by destination filter,9,False
You Gotta Play Uber And Lyft Off Of Each Other To Maximize Earnings!,HixNwFH3wTs,2021-08-24T04:18:09Z,UCaZiGrGjZhyYZmBTN5r11iw,374,you gotta play uber and lyft off of each other to maximize earnings,13,False
Doing Rideshare At Las Vegas World Market Center - 08/21,ta_znxR1aZs,2021-08-23T22:08:12Z,UCaZiGrGjZhyYZmBTN5r11iw,355,doing rideshare at las vegas world market center 08 21,10,False
Is It Worth Chasing Uber Surge?,0O5W1dhr6rY,2021-08-18T18:18:33Z,UCaZiGrGjZhyYZmBTN5r11iw,336,is it worth chasing uber surge,6,False
Are Ratings Truly Anonymous?,Q-LqyvpjMUU,2021-08-11T18:57:09Z,UCaZiGrGjZhyYZmBTN5r11iw,146,are ratings truly anonymous,4,False
School Is Back In Session - Be Prepared!,OQ1mtZEtlog,2021-08-11T01:25:01Z,UCaZiGrGjZhyYZmBTN5r11iw,189,school is back in session be prepared,7,False
How To Handle Scheduled Rides With Pax!,YG5guDLDuDE,2021-08-07T19:15:42Z,UCaZiGrGjZhyYZmBTN5r11iw,279,how to handle scheduled rides with pax,7,False
How To Check Your Driver RateCards In Uber & Lyft,mJ4DJOegKq4,2021-07-29T17:29:11Z,UCaZiGrGjZhyYZmBTN5r11iw,314,how to check your driver ratecards in uber lyft,9,False
Does Lyft Pay Rental Drivers Less?,qN0PbaC6ivE,2021-07-29T03:59:37Z,UCaZiGrGjZhyYZmBTN5r11iw,3038,does lyft pay rental drivers less,6,False
"How To Utilize Uber Work Hub, PLUS How To Avoid The 4-Pax in a Sedan!",DKr5MwDJ4I8,2021-07-27T06:16:38Z,UCaZiGrGjZhyYZmBTN5r11iw,1972,how to utilize uber work hub plus how to avoid the 4 pax in a sedan,16,False
Sometimes You Just Have To Live To Fight Another Day In Rideshare!,o71aMLMP_MU,2021-07-26T05:16:50Z,UCaZiGrGjZhyYZmBTN5r11iw,166,sometimes you just have to live to fight another day in rideshare,12,False
It’s As Simple As “Thanks For Coming To Vegas!,oRjDVOe7K1E,2021-07-22T20:59:04Z,UCaZiGrGjZhyYZmBTN5r11iw,110,it s as simple as thanks for coming to vegas,10,False
Turning Caesar’s Current Nightmare Into a Hopeful Tipping Friend,ekW2SSBnJvs,2021-07-19T06:10:54Z,UCaZiGrGjZhyYZmBTN5r11iw,178,turning caesar s current nightmare into a hopeful tipping friend,10,False
Why Am I Not Getting Paid More On Uber (Longer) Surge Rides?,yBhiVr3GpnU,2021-07-12T21:21:28Z,UCaZiGrGjZhyYZmBTN5r11iw,395,why am i not getting paid more on uber longer surge rides,12,False
